FID,title,description,category,price,length,rating,actors
1,ACADEMY DINOSAUR,A Epic Drama of a Feminist And a Mad Scientist who must Battle a Teacher in The Canadian Rockies,Documentary,0.99,86,PG,"WARREN NOLTE, OPRAH KILMER, ROCK DUKAKIS, MENA TEMPLE, JOHNNY CAGE, SANDRA PECK, CHRISTIAN GABLE, PENELOPE GUINESS, LUCILLE TRACY, MARY KEITEL"
2,ACE GOLDFINGER,A Astounding Epistle of a Database Administrator And a Explorer who must Find a Car in Ancient China,Horror,4.99,48,G,"CHRIS DEPP, SEAN GUINESS, MINNIE ZELLWEGER, BOB FAWCETT"
3,ADAPTATION HOLES,A Astounding Reflection of a Lumberjack And a Car who must Sink a Lumberjack in A Baloon Factory,Documentary,2.99,50,NC-17,"BOB FAWCETT, CAMERON STREEP, NICK WAHLBERG, RAY JOHANSSON, JULIANNE DENCH"
4,AFFAIR PREJUDICE,A Fanciful Documentary of a Frisbee And a Lumberjack who must Chase a Monkey in A Shark Tank,Horror,2.99,117,G,"OPRAH KILMER, FAY WINSLET, KENNETH PESCI, JODIE DEGENERES, SCARLETT DAMON"
5,AFRICAN EGG,A Fast-Paced Documentary of a Pastry Chef And a Dentist who must Pursue a Forensic Psychologist in The Gulf of Mexico,Family,2.99,130,G,"GARY PHOENIX, DUSTIN TAUTOU, MATTHEW LEIGH, MATTHEW CARREY, THORA TEMPLE"
6,AGENT TRUMAN,A Intrepid Panorama of a Robot And a Boy who must Escape a Sumo Wrestler in Ancient China,Foreign,2.99,169,PG,"WARREN NOLTE, JAYNE NEESON, KIRSTEN PALTROW, SANDRA KILMER, REESE WEST, KENNETH HOFFMAN, MORGAN WILLIAMS"
7,AIRPLANE SIERRA,A Touching Saga of a Hunter And a Butler who must Discover a Butler in A Jet Boat,Comedy,4.99,62,PG-13,"MICHAEL BOLGER, MENA HOPPER, JIM MOSTEL, RICHARD PENN, OPRAH KILMER"
8,AIRPORT POLLOCK,A Epic Tale of a Moose And a Girl who must Confront a Monkey in Ancient India,Horror,4.99,54,R,"LUCILLE DEE, FAY KILMER, GENE WILLIS, SUSAN DAVIS"
9,ALABAMA DEVIL,A Thoughtful Panorama of a Database Administrator And a Mad Scientist who must Outgun a Mad Scientist in A Jet Boat,Horror,2.99,114,PG-13,"ELVIS MARX, RIP CRAWFORD, MENA TEMPLE, RIP WINSLET, WARREN NOLTE, GRETA KEITEL, MERYL ALLEN, CHRISTIAN GABLE, WILLIAM HACKMAN"
10,ALADDIN CALENDAR,A Action-Packed Tale of a Man And a Lumberjack who must Reach a Feminist in Ancient China,Sports,4.99,63,NC-17,"JADA RYDER, ROCK DUKAKIS, GRETA MALDEN, RENEE TRACY, RAY JOHANSSON, VAL BOLGER, JUDY DEAN, ALEC WAYNE"
11,ALAMO VIDEOTAPE,A Boring Epistle of a Butler And a Cat who must Fight a Pastry Chef in A MySQL Convention,Foreign,0.99,126,G,"MICHAEL BENING, JOHNNY CAGE, SCARLETT DAMON, SEAN GUINESS"
12,ALASKA PHANTOM,A Fanciful Saga of a Hunter And a Pastry Chef who must Vanquish a Boy in Australia,Music,0.99,136,PG,"SYLVESTER DERN, ALBERT JOHANSSON, GENE MCKELLEN, JEFF SILVERSTONE, SIDNEY CROWE, VAL BOLGER, BURT POSEY"
13,ALI FOREVER,A Action-Packed Drama of a Dentist And a Crocodile who must Battle a Feminist in The Canadian Rockies,Horror,4.99,150,PG,"CARY MCCONAUGHEY, JON CHASE, MORGAN MCDORMAND, KENNETH TORN, CHRISTOPHER BERRY"
14,ALICE FANTASIA,A Emotional Drama of a A Shark And a Database Administrator who must Vanquish a Pioneer in Soviet Georgia,Classics,0.99,94,NC-17,"WOODY HOFFMAN, MORGAN WILLIAMS, MINNIE ZELLWEGER, ROCK DUKAKIS"
15,ALIEN CENTER,A Brilliant Drama of a Cat And a Mad Scientist who must Battle a Feminist in A MySQL Convention,Foreign,2.99,46,NC-17,"HUMPHREY WILLIS, MENA HOPPER, RENEE TRACY, SIDNEY CROWE, KENNETH PALTROW, BURT DUKAKIS"
16,ALLEY EVOLUTION,A Fast-Paced Drama of a Robot And a Composer who must Battle a Astronaut in New Orleans,Foreign,2.99,180,NC-17,"JOHN SUVARI, GREGORY GOODING, ALBERT JOHANSSON, JUDE CRUISE, KARL BERRY"
17,ALONE TRIP,A Fast-Paced Character Study of a Composer And a Dog who must Outgun a Boat in An Abandoned Fun House,Music,0.99,82,R,"UMA WOOD, KARL BERRY, ED CHASE, RENEE BALL, LAURENCE BULLOCK, CHRIS DEPP, SPENCER DEPP, WOODY JOLIE"
18,ALTER VICTORY,A Thoughtful Drama of a Composer And a Feminist who must Meet a Secret Agent in The Canadian Rockies,Animation,0.99,57,PG-13,"JADA RYDER, REESE KILMER, OPRAH KILMER, ANGELA WITHERSPOON"
19,AMADEUS HOLY,A Emotional Display of a Pioneer And a Technical Writer who must Battle a Man in A Baloon,Action,0.99,113,PG,"JOHNNY LOLLOBRIGIDA, JULIA MCQUEEN, VAL BOLGER, KIRK JOVOVICH, JAMES PITT, PENELOPE CRONYN"
20,AMELIE HELLFIGHTERS,A Boring Drama of a Woman And a Squirrel who must Conquer a Student in A Baloon,Music,4.99,79,R,"CARMEN HUNT, WALTER TORN, ED MANSFIELD, IAN TANDY, LAURA BRODY, EWAN GOODING"
21,AMERICAN CIRCUS,A Insightful Drama of a Girl And a Astronaut who must Face a Database Administrator in A Shark Tank,Action,4.99,129,R,"KEVIN BLOOM, RIP CRAWFORD, SIDNEY CROWE, WARREN JACKMAN, FRANCES TOMEI"
22,AMISTAD MIDSUMMER,A Emotional Character Study of a Dentist And a Crocodile who must Meet a Sumo Wrestler in California,New,2.99,85,G,"DARYL WAHLBERG, CARY MCCONAUGHEY, SALMA NOLTE, SCARLETT BENING"
23,ANACONDA CONFESSIONS,A Lacklusture Display of a Dentist And a Dentist who must Fight a Girl in Australia,Animation,0.99,92,R,"ELVIS MARX, HUMPHREY WILLIS, JAYNE NOLTE, PENELOPE GUINESS, JENNIFER DAVIS"
24,ANALYZE HOOSIERS,A Thoughtful Display of a Explorer And a Pastry Chef who must Overcome a Feminist in The Sahara Desert,Horror,2.99,181,R,"TOM MCKELLEN, TOM MIRANDA, JESSICA BAILEY, ED GUINESS, GRETA MALDEN"
25,ANGELS LIFE,A Thoughtful Display of a Woman And a Astronaut who must Battle a Robot in Berlin,New,2.99,74,G,"NICK DEGENERES, JULIA BARRYMORE, GRACE MOSTEL, JENNIFER DAVIS, PENELOPE GUINESS, CHRISTOPHER BERRY, ED MANSFIELD, LAURENCE BULLOCK, RENEE BALL"
26,ANNIE IDENTITY,A Amazing Panorama of a Pastry Chef And a Boat who must Escape a Woman in An Abandoned Amusement Park,Sci-Fi,0.99,86,G,"ADAM GRANT, CATE MCQUEEN, GRETA KEITEL"
27,ANONYMOUS HUMAN,A Amazing Reflection of a Database Administrator And a Astronaut who must Outrace a Database Administrator in A Shark Tank,Sports,0.99,179,NC-17,"SUSAN DAVIS, JIM MOSTEL, FAY KILMER, GRACE MOSTEL, EMILY DEE, MERYL GIBSON, MENA HOPPER, ED GUINESS, WHOOPI HURT"
28,ANTHEM LUKE,A Touching Panorama of a Waitress And a Woman who must Outrace a Dog in An Abandoned Amusement Park,Comedy,4.99,91,PG-13,"OPRAH KILMER, MILLA KEITEL"
29,ANTITRUST TOMATOES,A Fateful Yarn of a Womanizer And a Feminist who must Succumb a Database Administrator in Ancient India,Action,2.99,168,NC-17,"BETTE NICHOLSON, UMA WOOD, SIDNEY CROWE, SALMA NOLTE, WILLIAM HACKMAN, RENEE BALL, REESE WEST"
30,ANYTHING SAVANNAH,A Epic Story of a Pastry Chef And a Woman who must Chase a Feminist in An Abandoned Fun House,Horror,2.99,82,R,"JOE SWANK, LISA MONROE, CHRISTOPHER WEST"
31,APACHE DIVINE,A Awe-Inspiring Reflection of a Pastry Chef And a Teacher who must Overcome a Sumo Wrestler in A U-Boat,Family,4.99,92,NC-17,"CUBA OLIVIER, ANNE CRONYN, HENRY BERRY, NICK WAHLBERG"
32,APOCALYPSE FLAMINGOS,A Astounding Story of a Dog And a Squirrel who must Defeat a Woman in An Abandoned Amusement Park,New,4.99,119,R,"MAE HOFFMAN, VIVIEN BASINGER, OPRAH KILMER, WILL WILSON, RUSSELL CLOSE"
33,APOLLO TEEN,A Action-Packed Reflection of a Crocodile And a Explorer who must Find a Sumo Wrestler in An Abandoned Mine Shaft,Drama,2.99,153,PG-13,"DEBBIE AKROYD, MAE HOFFMAN, ALBERT JOHANSSON, WOODY JOLIE, ED MANSFIELD, OPRAH KILMER, MENA HOPPER, JEFF SILVERSTONE"
34,ARABIA DOGMA,A Touching Epistle of a Madman And a Mad Cow who must Defeat a Student in Nigeria,Horror,0.99,62,NC-17,"BURT POSEY, SEAN WILLIAMS, JUDE CRUISE, JOHNNY CAGE, JULIA MCQUEEN, RIP CRAWFORD, KARL BERRY, LISA MONROE, GRETA MALDEN, FRANCES TOMEI, RUSSELL BACALL, WALTER TORN"
35,ARACHNOPHOBIA ROLLERCOASTER,A Action-Packed Reflection of a Pastry Chef And a Composer who must Discover a Mad Scientist in The First Manned Space Station,Horror,2.99,147,PG-13,"RITA REYNOLDS, HUMPHREY GARLAND, GRACE MOSTEL, JUDY DEAN, EWAN GOODING, DARYL WAHLBERG, MORGAN HOPKINS, CUBA ALLEN"
36,ARGONAUTS TOWN,A Emotional Epistle of a Forensic Psychologist And a Butler who must Challenge a Waitress in An Abandoned Mine Shaft,Animation,0.99,127,PG-13,"GARY PENN, GENE WILLIS, KEVIN GARLAND, JULIA BARRYMORE, DAN STREEP"
37,ARIZONA BANG,A Brilliant Panorama of a Mad Scientist And a Mad Cow who must Meet a Pioneer in A Monastery,Classics,2.99,121,PG,"RAY JOHANSSON, KARL BERRY, RUSSELL BACALL, GRETA KEITEL"
38,ARK RIDGEMONT,A Beautiful Yarn of a Pioneer And a Monkey who must Pursue a Explorer in The Sahara Desert,Action,0.99,68,NC-17,"PARKER GOLDBERG, NICK DEGENERES, AUDREY BAILEY"
39,ARMAGEDDON LOST,A Fast-Paced Tale of a Boat And a Teacher who must Succumb a Composer in An Abandoned Mine Shaft,Sci-Fi,0.99,99,G,"CUBA ALLEN, ANGELA HUDSON, JAMES PITT, PENELOPE CRONYN, KIM ALLEN, GENE MCKELLEN, GREGORY GOODING"
40,ARMY FLINTSTONES,A Boring Saga of a Database Administrator And a Womanizer who must Battle a Waitress in Nigeria,Documentary,0.99,148,R,"PENELOPE CRONYN, GENE WILLIS, MAE HOFFMAN, CARY MCCONAUGHEY, ED CHASE, MATTHEW CARREY, RUSSELL CLOSE"
41,ARSENIC INDEPENDENCE,A Fanciful Documentary of a Mad Cow And a Womanizer who must Find a Dentist in Berlin,Travel,0.99,137,PG,"OPRAH KILMER, CUBA ALLEN, RITA REYNOLDS"
42,ARTIST COLDBLOODED,A Stunning Reflection of a Robot And a Moose who must Challenge a Woman in California,Sports,2.99,170,NC-17,"KIRK JOVOVICH, MERYL ALLEN, RENEE TRACY, SIDNEY CROWE, JAYNE NEESON, SANDRA KILMER, ED CHASE"
43,ATLANTIS CAUSE,A Thrilling Yarn of a Feminist And a Hunter who must Fight a Technical Writer in A Shark Tank,Family,2.99,170,G,"FRANCES TOMEI, AUDREY OLIVIER, WOODY HOFFMAN, JULIANNE DENCH, CUBA BIRCH, HARVEY HOPE, CHRIS DEPP, CATE HARRIS, GRETA KEITEL"
44,ATTACKS HATE,A Fast-Paced Panorama of a Technical Writer And a Mad Scientist who must Find a Feminist in An Abandoned Mine Shaft,Sci-Fi,4.99,113,PG-13,"GROUCHO DUNST, MILLA KEITEL, DAN TORN, BURT TEMPLE"
45,ATTRACTION NEWTON,A Astounding Panorama of a Composer And a Frisbee who must Reach a Husband in Ancient Japan,New,4.99,83,PG-13,"CHRISTOPHER WEST, GARY PENN, RIP WINSLET, UMA WOOD"
46,AUTUMN CROW,A Beautiful Tale of a Dentist And a Mad Cow who must Battle a Moose in The Sahara Desert,Games,4.99,108,G,"JAMES PITT, ANGELA HUDSON, DUSTIN TAUTOU"
47,BABY HALL,A Boring Character Study of a A Shark And a Girl who must Outrace a Feminist in An Abandoned Mine Shaft,Foreign,4.99,153,NC-17,"MINNIE KILMER, VIVIEN BASINGER, RIVER DEAN, KEVIN GARLAND, DARYL WAHLBERG, CHARLIZE DENCH, MATTHEW JOHANSSON, NICK WAHLBERG"
48,BACKLASH UNDEFEATED,A Stunning Character Study of a Mad Scientist And a Mad Cow who must Kill a Car in A Monastery,Children,4.99,118,PG-13,"CHRISTOPHER BERRY, SPENCER PECK, DAN STREEP, KEVIN GARLAND, SYLVESTER DERN, JANE JACKMAN, CHRISTIAN AKROYD"
49,BADMAN DAWN,A Emotional Panorama of a Pioneer And a Composer who must Escape a Mad Scientist in A Jet Boat,Sci-Fi,2.99,162,R,"ALAN DREYFUSS, WARREN JACKMAN, GRETA KEITEL, OLYMPIA PFEIFFER, THORA TEMPLE, BEN WILLIS, HARRISON BALE, CUBA ALLEN"
50,BAKED CLEOPATRA,A Stunning Drama of a Forensic Psychologist And a Husband who must Overcome a Waitress in A Monastery,Family,2.99,182,G,MICHELLE MCCONAUGHEY
51,BALLOON HOMEWARD,A Insightful Panorama of a Forensic Psychologist And a Mad Cow who must Build a Mad Scientist in The First Manned Space Station,Music,2.99,75,NC-17,"RENEE BALL, PARKER GOLDBERG, RICHARD PENN, MENA TEMPLE, GARY PENN, ROCK DUKAKIS"
52,BALLROOM MOCKINGBIRD,A Thrilling Documentary of a Composer And a Monkey who must Find a Feminist in California,Foreign,0.99,173,G,"DARYL WAHLBERG, HARRISON BALE, BEN WILLIS, GENE MCKELLEN, LUCILLE DEE, JUDY DEAN, ADAM GRANT"
53,BANG KWAI,A Epic Drama of a Madman And a Cat who must Face a A Shark in An Abandoned Amusement Park,Family,2.99,87,NC-17,"BETTE NICHOLSON, SANDRA PECK, JULIA BARRYMORE, MICHELLE MCCONAUGHEY, WALTER TORN, RUSSELL TEMPLE, FAY WOOD"
54,BANGER PINOCCHIO,A Awe-Inspiring Drama of a Car And a Pastry Chef who must Chase a Crocodile in The First Manned Space Station,Music,0.99,113,R,"JOHNNY LOLLOBRIGIDA, LUCILLE TRACY, DUSTIN TAUTOU, JAYNE NEESON, GENE WILLIS, AUDREY BAILEY"
55,BARBARELLA STREETCAR,A Awe-Inspiring Story of a Feminist And a Cat who must Conquer a Dog in A Monastery,Sci-Fi,2.99,65,G,"MARY TANDY, CUBA ALLEN, NICK DEGENERES, ALAN DREYFUSS, GENE MCKELLEN"
56,BAREFOOT MANCHURIAN,A Intrepid Story of a Cat And a Student who must Vanquish a Girl in An Abandoned Amusement Park,Action,2.99,129,G,"JENNIFER DAVIS, MORGAN WILLIAMS, ED MANSFIELD, DARYL CRAWFORD, KIRK JOVOVICH, WILL WILSON, ELVIS MARX, MILLA PECK"
57,BASIC EASY,A Stunning Epistle of a Man And a Husband who must Reach a Mad Scientist in A Jet Boat,Travel,2.99,90,PG-13,"GROUCHO WILLIAMS, EWAN GOODING, GRETA KEITEL, JESSICA BAILEY, PENELOPE MONROE, EMILY DEE"
58,BEACH HEARTBREAKERS,A Fateful Display of a Womanizer And a Mad Scientist who must Outgun a A Shark in Soviet Georgia,Documentary,2.99,122,G,"WOODY HOFFMAN, HARVEY HOPE, FRANCES TOMEI, GENE WILLIS, BEN WILLIS, MENA TEMPLE, NICK STALLONE"
59,BEAR GRACELAND,A Astounding Saga of a Dog And a Boy who must Kill a Teacher in The First Manned Space Station,Children,2.99,160,R,"SCARLETT DAMON, PENELOPE CRONYN, BEN HARRIS"
60,BEAST HUNCHBACK,A Awe-Inspiring Epistle of a Student And a Squirrel who must Defeat a Boy in Ancient China,Classics,4.99,89,R,"KENNETH TORN, SUSAN DAVIS, BETTE NICHOLSON, JODIE DEGENERES, ANGELINA ASTAIRE"
61,BEAUTY GREASE,A Fast-Paced Display of a Composer And a Moose who must Sink a Robot in An Abandoned Mine Shaft,Drama,4.99,175,G,"MICHAEL BENING, LUCILLE DEE, ED MANSFIELD, NICK DEGENERES, CAMERON ZELLWEGER"
62,BED HIGHBALL,A Astounding Panorama of a Lumberjack And a Dog who must Redeem a Woman in An Abandoned Fun House,Documentary,2.99,106,NC-17,"AUDREY BAILEY, JENNIFER DAVIS, ALBERT NOLTE, SUSAN DAVIS, GINA DEGENERES"
63,BEDAZZLED MARRIED,A Astounding Character Study of a Madman And a Robot who must Meet a Mad Scientist in An Abandoned Fun House,Family,0.99,73,PG,"PENELOPE MONROE, JAYNE NOLTE, REESE WEST, LAURENCE BULLOCK, DAN HARRIS, LUCILLE TRACY, GARY PHOENIX"
64,BEETHOVEN EXORCIST,A Epic Display of a Pioneer And a Student who must Challenge a Butler in The Gulf of Mexico,Drama,0.99,151,PG-13,"BELA WALKEN, SANDRA PECK, WARREN JACKMAN, SCARLETT BENING, MINNIE KILMER, VIVIEN BASINGER"
65,BEHAVIOR RUNAWAY,A Unbelieveable Drama of a Student And a Husband who must Outrace a Sumo Wrestler in Berlin,Horror,4.99,100,PG,"TIM HACKMAN, REESE KILMER, DARYL WAHLBERG, ED GUINESS, RITA REYNOLDS"
66,BENEATH RUSH,A Astounding Panorama of a Man And a Monkey who must Discover a Man in The First Manned Space Station,Children,0.99,53,NC-17,"SUSAN DAVIS, GENE WILLIS, REESE KILMER, CHRIS BRIDGES, ANGELINA ASTAIRE, VIVIEN BASINGER, JANE JACKMAN"
67,BERETS AGENT,A Taut Saga of a Crocodile And a Boy who must Overcome a Technical Writer in Ancient China,Action,2.99,77,PG-13,"GRACE MOSTEL, JULIA BARRYMORE, JULIA FAWCETT, JULIANNE DENCH, JESSICA BAILEY, CATE HARRIS, ANGELA WITHERSPOON, IAN TANDY, WILLIAM HACKMAN, MERYL ALLEN"
68,BETRAYED REAR,A Emotional Character Study of a Boat And a Pioneer who must Find a Explorer in A Shark Tank,Children,4.99,122,NC-17,"CHRISTIAN AKROYD, NICK DEGENERES, MORGAN MCDORMAND, ANGELINA ASTAIRE"
69,BEVERLY OUTLAW,A Fanciful Documentary of a Womanizer And a Boat who must Defeat a Madman in The First Manned Space Station,Sci-Fi,2.99,85,R,"JODIE DEGENERES, RALPH CRUZ, JOHN SUVARI, SANDRA PECK"
70,BIKINI BORROWERS,A Astounding Drama of a Astronaut And a Cat who must Discover a Woman in The First Manned Space Station,Animation,4.99,142,NC-17,"PENELOPE CRONYN, BETTE NICHOLSON"
71,BILKO ANONYMOUS,A Emotional Reflection of a Teacher And a Man who must Meet a Cat in The First Manned Space Station,Family,4.99,100,PG-13,"RUSSELL CLOSE, ELLEN PRESLEY, GOLDIE BRODY"
72,BILL OTHERS,A Stunning Saga of a Mad Scientist And a Forensic Psychologist who must Challenge a Squirrel in A MySQL Convention,Documentary,2.99,93,PG,"RUSSELL TEMPLE, CHRIS BRIDGES, MINNIE ZELLWEGER, DUSTIN TAUTOU, AL GARLAND, LAURENCE BULLOCK"
73,BINGO TALENTED,A Touching Tale of a Girl And a Crocodile who must Discover a Waitress in Nigeria,Sci-Fi,2.99,150,PG-13,"RENEE BALL, CARY MCCONAUGHEY, CAMERON WRAY, GOLDIE BRODY, JON CHASE"
74,BIRCH ANTITRUST,A Fanciful Panorama of a Husband And a Pioneer who must Outgun a Dog in A Baloon,Music,4.99,162,PG,"MATTHEW CARREY, EWAN GOODING, DARYL WAHLBERG, WOODY HOFFMAN, JOE SWANK, ALAN DREYFUSS"
75,BIRD INDEPENDENCE,A Thrilling Documentary of a Car And a Student who must Sink a Hunter in The Canadian Rockies,Travel,4.99,163,G,"JAYNE NOLTE, FAY KILMER"
76,BIRDCAGE CASPER,A Fast-Paced Saga of a Frisbee And a Astronaut who must Overcome a Feminist in Ancient India,Music,0.99,103,NC-17,"SALMA NOLTE, KENNETH TORN, KENNETH PESCI, RENEE BALL"
77,BIRDS PERDITION,A Boring Story of a Womanizer And a Pioneer who must Face a Dog in California,New,4.99,61,G,"SANDRA PECK, GARY PENN, SYLVESTER DERN, WHOOPI HURT"
78,BLACKOUT PRIVATE,A Intrepid Yarn of a Pastry Chef And a Mad Scientist who must Challenge a Secret Agent in Ancient Japan,Animation,2.99,85,PG,"CARY MCCONAUGHEY, CAMERON ZELLWEGER, KENNETH HOFFMAN, MATTHEW CARREY, SANDRA KILMER"
79,BLADE POLISH,A Thoughtful Character Study of a Frisbee And a Pastry Chef who must Fight a Dentist in The First Manned Space Station,Drama,0.99,114,PG-13,"JENNIFER DAVIS, ALEC WAYNE, KEVIN GARLAND, RIVER DEAN, ANGELA WITHERSPOON"
80,BLANKET BEVERLY,A Emotional Documentary of a Student And a Girl who must Build a Boat in Nigeria,Family,2.99,148,G,"FRED COSTNER, BURT TEMPLE, ALAN DREYFUSS, THORA TEMPLE"
81,BLINDNESS GUN,A Touching Drama of a Robot And a Dentist who must Meet a Hunter in A Jet Boat,Sci-Fi,4.99,103,PG-13,"ADAM HOPPER, CHRIS BRIDGES, BURT DUKAKIS"
82,BLOOD ARGONAUTS,A Boring Drama of a Explorer And a Man who must Kill a Lumberjack in A Manhattan Penthouse,Family,0.99,71,G,"CUBA BIRCH, LAURA BRODY, ADAM HOPPER, CATE MCQUEEN"
83,BLUES INSTINCT,A Insightful Documentary of a Boat And a Composer who must Meet a Forensic Psychologist in An Abandoned Fun House,Family,2.99,50,G,"CAMERON STREEP, MATTHEW CARREY, SALMA NOLTE, GROUCHO DUNST"
84,BOILED DARES,A Awe-Inspiring Story of a Waitress And a Dog who must Discover a Dentist in Ancient Japan,Travel,4.99,102,PG,"GREGORY GOODING, DAN TORN, MORGAN HOPKINS, TIM HACKMAN, NICK STALLONE, PENELOPE PINKETT, JIM MOSTEL, JULIA FAWCETT"
85,BONNIE HOLOCAUST,A Fast-Paced Story of a Crocodile And a Robot who must Find a Moose in Ancient Japan,Documentary,0.99,63,G,"JOHNNY LOLLOBRIGIDA, JULIA MCQUEEN, HENRY BERRY, MINNIE ZELLWEGER, SUSAN DAVIS, FRANCES TOMEI, FAY WINSLET, OPRAH KILMER, ED GUINESS"
86,BOOGIE AMELIE,A Lacklusture Character Study of a Husband And a Sumo Wrestler who must Succumb a Technical Writer in The Gulf of Mexico,Music,4.99,121,R,"GROUCHO SINATRA, GENE MCKELLEN, JODIE DEGENERES, MERYL ALLEN, KEVIN BLOOM, NICK DEGENERES"
87,BOONDOCK BALLROOM,A Fateful Panorama of a Crocodile And a Boy who must Defeat a Monkey in The Gulf of Mexico,Travel,0.99,76,NC-17,"KIRSTEN PALTROW, SANDRA PECK, DAN HARRIS, RAY JOHANSSON, KENNETH PESCI, CHRIS BRIDGES, WARREN JACKMAN, AUDREY BAILEY, HUMPHREY GARLAND, ED CHASE, JENNIFER DAVIS, UMA WOOD, FRED COSTNER"
88,BORN SPINAL,A Touching Epistle of a Frisbee And a Husband who must Pursue a Student in Nigeria,Travel,4.99,179,PG,"MERYL ALLEN, RITA REYNOLDS, KENNETH PALTROW, DAN STREEP, SISSY SOBIESKI, DUSTIN TAUTOU, NICK STALLONE, RAY JOHANSSON, KIRSTEN PALTROW"
89,BORROWERS BEDAZZLED,A Brilliant Epistle of a Teacher And a Sumo Wrestler who must Defeat a Man in An Abandoned Fun House,Animation,0.99,63,G,"CUBA OLIVIER, ELVIS MARX, KIRK JOVOVICH, SCARLETT DAMON, DARYL CRAWFORD, HARVEY HOPE, JON CHASE"
90,BOULEVARD MOB,A Fateful Epistle of a Moose And a Monkey who must Confront a Lumberjack in Ancient China,New,0.99,63,R,"HARVEY HOPE, MORGAN MCDORMAND, KIRSTEN AKROYD, DAN STREEP, EWAN GOODING, ANGELA WITHERSPOON, RIP CRAWFORD, AUDREY OLIVIER"
91,BOUND CHEAPER,A Thrilling Panorama of a Database Administrator And a Astronaut who must Challenge a Lumberjack in A Baloon,Classics,0.99,98,PG,"CUBA OLIVIER, KARL BERRY"
92,BOWFINGER GABLES,A Fast-Paced Yarn of a Waitress And a Composer who must Outgun a Dentist in California,Horror,4.99,72,NC-17,"WILL WILSON, MINNIE ZELLWEGER, MICHELLE MCCONAUGHEY, CARMEN HUNT, KARL BERRY"
93,BRANNIGAN SUNRISE,A Amazing Epistle of a Moose And a Crocodile who must Outrace a Dog in Berlin,New,4.99,121,PG,"KENNETH HOFFMAN, RIP CRAWFORD"
94,BRAVEHEART HUMAN,A Insightful Story of a Dog And a Pastry Chef who must Battle a Girl in Berlin,Family,2.99,176,PG-13,"JAYNE NOLTE, JANE JACKMAN, KIRSTEN AKROYD, NICK STALLONE"
95,BREAKFAST GOLDFINGER,A Beautiful Reflection of a Student And a Student who must Fight a Moose in Berlin,New,4.99,123,G,"AL GARLAND, JULIA ZELLWEGER, MICHAEL BOLGER, RUSSELL TEMPLE, ANGELINA ASTAIRE"
96,BREAKING HOME,A Beautiful Display of a Secret Agent And a Monkey who must Battle a Sumo Wrestler in An Abandoned Mine Shaft,New,2.99,169,PG-13,"MORGAN WILLIAMS, HELEN VOIGHT, FRANCES TOMEI, CARMEN HUNT, WOODY HOFFMAN, GRACE MOSTEL"
97,BRIDE INTRIGUE,A Epic Tale of a Robot And a Monkey who must Vanquish a Man in New Orleans,Action,0.99,56,G,ANGELA HUDSON
98,BRIGHT ENCOUNTERS,A Fateful Yarn of a Lumberjack And a Feminist who must Conquer a Student in A Jet Boat,Drama,4.99,73,PG-13,"CAMERON ZELLWEGER, ALBERT NOLTE, RENEE BALL, MERYL ALLEN"
99,BRINGING HYSTERICAL,A Fateful Saga of a A Shark And a Technical Writer who must Find a Woman in A Jet Boat,Comedy,2.99,136,PG,"FRANCES DAY-LEWIS, ANGELA WITHERSPOON"
100,BROOKLYN DESERT,A Beautiful Drama of a Dentist And a Composer who must Battle a Sumo Wrestler in The First Manned Space Station,Foreign,4.99,161,R,"GROUCHO WILLIAMS, ALBERT NOLTE, SEAN GUINESS, JAYNE NEESON, JODIE DEGENERES"
101,BROTHERHOOD BLANKET,A Fateful Character Study of a Butler And a Technical Writer who must Sink a Astronaut in Ancient Japan,Documentary,0.99,73,R,"FRANCES DAY-LEWIS, JAYNE NEESON, DARYL CRAWFORD, FRED COSTNER, JUDE CRUISE"
102,BUBBLE GROSSE,A Awe-Inspiring Panorama of a Crocodile And a Moose who must Confront a Girl in A Baloon,Sports,4.99,60,R,"MENA HOPPER, VIVIEN BASINGER, ROCK DUKAKIS"
103,BUCKET BROTHERHOOD,A Amazing Display of a Girl And a Womanizer who must Succumb a Lumberjack in A Baloon Factory,Travel,4.99,133,PG,"CHARLIZE DENCH, BURT TEMPLE, GARY PHOENIX, TIM HACKMAN, KIRSTEN AKROYD, RIP CRAWFORD"
104,BUGSY SONG,A Awe-Inspiring Character Study of a Secret Agent And a Boat who must Find a Squirrel in The First Manned Space Station,Foreign,2.99,119,G,"KIRSTEN AKROYD, WOODY JOLIE"
105,BULL SHAWSHANK,A Fanciful Drama of a Moose And a Squirrel who must Conquer a Pioneer in The Canadian Rockies,Action,0.99,125,NC-17,"DAN STREEP, KIRK JOVOVICH, ALEC WAYNE, ANGELA WITHERSPOON, SANDRA KILMER, NICK WAHLBERG, JAYNE NOLTE, JULIANNE DENCH"
106,BULWORTH COMMANDMENTS,A Amazing Display of a Mad Cow And a Pioneer who must Redeem a Sumo Wrestler in The Outback,Games,2.99,61,G,"PENELOPE GUINESS, ANGELA HUDSON, SCARLETT BENING, ALAN DREYFUSS"
107,BUNCH MINDS,A Emotional Story of a Feminist And a Feminist who must Escape a Pastry Chef in A MySQL Convention,Drama,2.99,63,G,"EWAN GOODING, JADA RYDER, GRETA KEITEL, KARL BERRY, WOODY HOFFMAN, LAURENCE BULLOCK, JOHNNY CAGE, CHRIS BRIDGES"
108,BUTCH PANTHER,A Lacklusture Yarn of a Feminist And a Database Administrator who must Face a Hunter in New Orleans,New,0.99,67,PG-13,"CUBA OLIVIER, CARMEN HUNT, GROUCHO DUNST"
109,BUTTERFLY CHOCOLAT,A Fateful Story of a Girl And a Composer who must Conquer a Husband in A Shark Tank,New,0.99,89,G,"KIM ALLEN, NICK STALLONE, ED GUINESS, MENA TEMPLE, BURT TEMPLE, MARY KEITEL, LISA MONROE"
110,CABIN FLASH,A Stunning Epistle of a Boat And a Man who must Challenge a A Shark in A Baloon Factory,Children,0.99,53,NC-17,"RENEE BALL, BEN WILLIS, ALEC WAYNE, UMA WOOD"
111,CADDYSHACK JEDI,A Awe-Inspiring Epistle of a Woman And a Madman who must Fight a Robot in Soviet Georgia,Action,0.99,52,NC-17,"ED CHASE, ELVIS MARX, TOM MCKELLEN, NATALIE HOPKINS, KENNETH PALTROW, MERYL GIBSON, ROCK DUKAKIS"
112,CALENDAR GUNFIGHT,A Thrilling Drama of a Frisbee And a Lumberjack who must Sink a Man in Nigeria,Foreign,4.99,120,NC-17,"GARY PHOENIX, WHOOPI HURT, GRETA KEITEL, GINA DEGENERES, MILLA PECK, TIM HACKMAN, CAMERON STREEP, BETTE NICHOLSON"
113,CALIFORNIA BIRDS,A Thrilling Yarn of a Database Administrator And a Robot who must Battle a Database Administrator in Ancient India,Sports,4.99,75,NC-17,"SCARLETT BENING, RUSSELL CLOSE"
114,CAMELOT VACATION,A Touching Character Study of a Woman And a Waitress who must Battle a Pastry Chef in A MySQL Convention,Sci-Fi,0.99,61,NC-17,"JUDE CRUISE, ALBERT NOLTE"
115,CAMPUS REMEMBER,A Astounding Drama of a Crocodile And a Mad Cow who must Build a Robot in A Jet Boat,Action,2.99,167,R,"MATTHEW JOHANSSON, WILL WILSON, REESE KILMER"
116,CANDIDATE PERDITION,A Brilliant Epistle of a Composer And a Database Administrator who must Vanquish a Mad Scientist in The First Manned Space Station,Classics,2.99,70,R,"MORGAN HOPKINS, SIDNEY CROWE, SANDRA KILMER, THORA TEMPLE"
117,CANDLES GRAPES,A Fanciful Character Study of a Monkey And a Explorer who must Build a Astronaut in An Abandoned Fun House,Games,4.99,135,NC-17,"REESE KILMER, JOHN SUVARI, MILLA KEITEL, ANGELA HUDSON, CHARLIZE DENCH, SANDRA KILMER, ALBERT JOHANSSON"
118,CANYON STOCK,A Thoughtful Reflection of a Waitress And a Feminist who must Escape a Squirrel in A Manhattan Penthouse,Animation,0.99,85,R,"RUSSELL TEMPLE, MATTHEW LEIGH, SPENCER DEPP, RALPH CRUZ, VAL BOLGER, ZERO CAGE"
119,CAPER MOTIONS,A Fateful Saga of a Moose And a Car who must Pursue a Woman in A MySQL Convention,Comedy,0.99,176,G,"CHRISTIAN AKROYD, VAL BOLGER, AUDREY OLIVIER, KEVIN GARLAND, CATE MCQUEEN, BURT TEMPLE, HELEN VOIGHT"
120,CARIBBEAN LIBERTY,A Fanciful Tale of a Pioneer And a Technical Writer who must Outgun a Pioneer in A Shark Tank,Sports,4.99,92,NC-17,"SUSAN DAVIS, KIM ALLEN, HARVEY HOPE, LAURENCE BULLOCK, JANE JACKMAN, BEN WILLIS, ELLEN PRESLEY, CHRIS BRIDGES"
