FID,title,description,category,price,length,rating,actors
485,JERSEY SASSY,A Lacklusture Documentary of a Madman And a Mad Cow who must Find a Feminist in Ancient Japan,Children,4.99,60,PG,"CATE MCQUEEN, JOHN SUVARI, RIVER DEAN, ED MANSFIELD, WALTER TORN, FAY KILMER, VAL BOLGER, ZERO CAGE, NICK WAHLBERG"
486,JET NEIGHBORS,A Amazing Display of a Lumberjack And a Teacher who must Outrace a Woman in A U-Boat,Foreign,4.99,59,R,"FAY KILMER, GREG CHAPLIN, GENE WILLIS, HUMPHREY GARLAND, MERYL ALLEN, MINNIE KILMER"
487,JINGLE SAGEBRUSH,A Epic Character Study of a Feminist And a Student who must Meet a Woman in A Baloon,Classics,4.99,124,PG-13,"KIM ALLEN, GROUCHO WILLIAMS"
488,JOON NORTHWEST,A Thrilling Panorama of a Technical Writer And a Car who must Discover a Forensic Psychologist in A Shark Tank,Sports,0.99,105,NC-17,"CHARLIZE DENCH, ALEC WAYNE"
489,JUGGLER HARDLY,A Epic Story of a Mad Cow And a Astronaut who must Challenge a Car in California,Animation,0.99,54,PG-13,"MILLA PECK, PENELOPE PINKETT, CAMERON ZELLWEGER, PENELOPE MONROE, SALMA NOLTE, MORGAN WILLIAMS, EWAN GOODING, MERYL GIBSON, ED GUINESS"
490,JUMANJI BLADE,A Intrepid Yarn of a Husband And a Womanizer who must Pursue a Mad Scientist in New Orleans,New,2.99,121,G,"BOB FAWCETT, JENNIFER DAVIS, NICK STALLONE, GARY PHOENIX, JIM MOSTEL, MENA TEMPLE"
491,JUMPING WRATH,A Touching Epistle of a Monkey And a Feminist who must Discover a Boat in Berlin,Children,0.99,74,NC-17,"SALMA NOLTE, SUSAN DAVIS, ANGELA HUDSON, SANDRA KILMER, ELVIS MARX, JAMES PITT, ALAN DREYFUSS, CATE HARRIS"
492,JUNGLE CLOSER,A Boring Character Study of a Boy And a Woman who must Battle a Astronaut in Australia,New,0.99,134,NC-17,"MENA TEMPLE, LUCILLE TRACY, DAN STREEP, BURT POSEY, CUBA BIRCH, HUMPHREY GARLAND"
493,KANE EXORCIST,A Epic Documentary of a Composer And a Robot who must Overcome a Car in Berlin,Foreign,0.99,92,R,"BURT DUKAKIS, HENRY BERRY, CHRISTOPHER BERRY, GROUCHO WILLIAMS, AUDREY OLIVIER"
494,KARATE MOON,A Astounding Yarn of a Womanizer And a Dog who must Reach a Waitress in A MySQL Convention,Horror,0.99,120,PG-13,"JAYNE SILVERSTONE, MICHAEL BOLGER, KIM ALLEN, JADA RYDER, JANE JACKMAN, JULIANNE DENCH, JOHNNY CAGE, SUSAN DAVIS"
495,KENTUCKIAN GIANT,A Stunning Yarn of a Woman And a Frisbee who must Escape a Waitress in A U-Boat,Horror,2.99,169,PG,"ELVIS MARX, WARREN NOLTE, VIVIEN BERGEN, RUSSELL CLOSE"
496,KICK SAVANNAH,A Emotional Drama of a Monkey And a Robot who must Defeat a Monkey in New Orleans,Travel,0.99,179,PG-13,"ANGELA HUDSON, JESSICA BAILEY, GRETA MALDEN, LAURENCE BULLOCK, ALAN DREYFUSS, MICHAEL BENING"
497,KILL BROTHERHOOD,A Touching Display of a Hunter And a Secret Agent who must Redeem a Husband in The Outback,Documentary,0.99,54,G,"KIRSTEN PALTROW, WOODY JOLIE, ALBERT NOLTE, RIVER DEAN, RIP WINSLET"
498,KILLER INNOCENT,A Fanciful Character Study of a Student And a Explorer who must Succumb a Composer in An Abandoned Mine Shaft,Family,2.99,161,R,"MERYL ALLEN, WHOOPI HURT, DARYL WAHLBERG, ANGELINA ASTAIRE, BURT POSEY"
499,KING EVOLUTION,A Action-Packed Tale of a Boy And a Lumberjack who must Chase a Madman in A Baloon,Family,4.99,184,NC-17,"PENELOPE GUINESS, LUCILLE TRACY, BURT DUKAKIS, CUBA ALLEN, RENEE BALL, MARY KEITEL"
500,KISS GLORY,A Lacklusture Reflection of a Girl And a Husband who must Find a Robot in The Canadian Rockies,Foreign,4.99,163,PG-13,"JULIA MCQUEEN, TOM MIRANDA, GROUCHO DUNST, OPRAH KILMER, HUMPHREY GARLAND, CUBA OLIVIER, HELEN VOIGHT"
501,KISSING DOLLS,A Insightful Reflection of a Pioneer And a Teacher who must Build a Composer in The First Manned Space Station,Action,4.99,141,R,"GEOFFREY HESTON, JADA RYDER, TOM MCKELLEN"
502,KNOCK WARLOCK,A Unbelieveable Story of a Teacher And a Boat who must Confront a Moose in A Baloon,Comedy,2.99,71,PG-13,"WOODY HOFFMAN, AUDREY OLIVIER, CUBA OLIVIER, TOM MIRANDA, REESE KILMER, JUDE CRUISE"
503,KRAMER CHOCOLATE,A Amazing Yarn of a Robot And a Pastry Chef who must Redeem a Mad Scientist in The Outback,Sports,2.99,171,R,"MILLA KEITEL, WOODY JOLIE, JULIANNE DENCH, JOHNNY LOLLOBRIGIDA, BETTE NICHOLSON, FRED COSTNER, JULIA MCQUEEN, REESE KILMER"
504,KWAI HOMEWARD,A Amazing Drama of a Car And a Squirrel who must Pursue a Car in Soviet Georgia,Drama,0.99,46,PG-13,"NATALIE HOPKINS, MICHELLE MCCONAUGHEY, JADA RYDER, ANGELA WITHERSPOON, FAY WOOD"
505,LABYRINTH LEAGUE,A Awe-Inspiring Saga of a Composer And a Frisbee who must Succumb a Pioneer in The Sahara Desert,Children,2.99,46,PG-13,"GROUCHO SINATRA, KIRSTEN AKROYD, GROUCHO DUNST, KENNETH HOFFMAN, SCARLETT DAMON, TOM MIRANDA"
506,LADY STAGE,A Beautiful Character Study of a Woman And a Man who must Pursue a Explorer in A U-Boat,Horror,4.99,67,PG,"PENELOPE GUINESS, FRANCES DAY-LEWIS, ANNE CRONYN, RAY JOHANSSON, PENELOPE CRONYN, HARRISON BALE, ROCK DUKAKIS, JEFF SILVERSTONE"
507,LADYBUGS ARMAGEDDON,A Fateful Reflection of a Dog And a Mad Scientist who must Meet a Mad Scientist in New Orleans,Games,0.99,113,NC-17,"MATTHEW CARREY, GRETA KEITEL, WARREN NOLTE, KIRSTEN PALTROW"
508,LAMBS CINCINATTI,A Insightful Story of a Man And a Feminist who must Fight a Composer in Australia,Games,4.99,144,PG-13,"MENA HOPPER, CAMERON ZELLWEGER, VAL BOLGER, WALTER TORN, FAY WINSLET, JAYNE NOLTE, BURT POSEY, CHRISTIAN NEESON, MENA TEMPLE, JULIA BARRYMORE, REESE KILMER, WOODY HOFFMAN, JULIA ZELLWEGER, SCARLETT DAMON, LUCILLE DEE"
509,LANGUAGE COWBOY,A Epic Yarn of a Cat And a Madman who must Vanquish a Dentist in An Abandoned Amusement Park,Children,0.99,78,NC-17,"CHRISTOPHER BERRY, CUBA BIRCH, WHOOPI HURT, PENELOPE GUINESS, BETTE NICHOLSON, WARREN JACKMAN"
510,LAWLESS VISION,A Insightful Yarn of a Boy And a Sumo Wrestler who must Outgun a Car in The Outback,Animation,4.99,181,G,"MICHAEL BOLGER, PENELOPE PINKETT, BOB FAWCETT, JOE SWANK"
511,LAWRENCE LOVE,A Fanciful Yarn of a Database Administrator And a Mad Cow who must Pursue a Womanizer in Berlin,Action,0.99,175,NC-17,"CHRISTOPHER BERRY, SUSAN DAVIS"
512,LEAGUE HELLFIGHTERS,A Thoughtful Saga of a A Shark And a Monkey who must Outgun a Student in Ancient China,Classics,4.99,110,PG-13,"CUBA BIRCH, ALBERT JOHANSSON, JIM MOSTEL, KIRSTEN AKROYD, JESSICA BAILEY, KENNETH TORN"
513,LEATHERNECKS DWARFS,A Fateful Reflection of a Dog And a Mad Cow who must Outrace a Teacher in An Abandoned Mine Shaft,Travel,2.99,153,PG-13,"KARL BERRY, UMA WOOD, BOB FAWCETT, SPENCER DEPP, SUSAN DAVIS, PENELOPE MONROE, IAN TANDY"
514,LEBOWSKI SOLDIERS,A Beautiful Epistle of a Secret Agent And a Pioneer who must Chase a Astronaut in Ancient China,Drama,2.99,69,PG-13,"ALBERT JOHANSSON, RICHARD PENN, JOE SWANK"
515,LEGALLY SECRETARY,A Astounding Tale of a A Shark And a Moose who must Meet a Womanizer in The Sahara Desert,Children,4.99,113,PG,"JANE JACKMAN, CARMEN HUNT, CAMERON STREEP, UMA WOOD, HELEN VOIGHT, BELA WALKEN"
516,LEGEND JEDI,A Awe-Inspiring Epistle of a Pioneer And a Student who must Outgun a Crocodile in The Outback,Music,0.99,59,PG,"CATE MCQUEEN, PENELOPE CRONYN, ANGELA HUDSON, TOM MCKELLEN"
517,LESSON CLEOPATRA,A Emotional Display of a Man And a Explorer who must Build a Boy in A Manhattan Penthouse,Sports,0.99,167,NC-17,"JON CHASE, LISA MONROE, ROCK DUKAKIS, BETTE NICHOLSON, CARMEN HUNT, CAMERON WRAY, ANGELA HUDSON, KENNETH TORN, WALTER TORN, WARREN NOLTE, CUBA ALLEN, LIZA BERGMAN"
518,LIAISONS SWEET,A Boring Drama of a A Shark And a Explorer who must Redeem a Waitress in The Canadian Rockies,Travel,4.99,140,PG,"CHRISTIAN NEESON, MICHAEL BOLGER, FAY WOOD, MEG HAWKE, NICK WAHLBERG, MENA TEMPLE"
519,LIBERTY MAGNIFICENT,A Boring Drama of a Student And a Cat who must Sink a Technical Writer in A Baloon,Sports,2.99,138,G,"CHRISTIAN NEESON, ALEC WAYNE, BETTE NICHOLSON, CUBA BIRCH, WILL WILSON, GREG CHAPLIN, BEN WILLIS"
520,LICENSE WEEKEND,A Insightful Story of a Man And a Husband who must Overcome a Madman in A Monastery,Sci-Fi,2.99,91,NC-17,"JAYNE SILVERSTONE, RUSSELL CLOSE, DARYL CRAWFORD, NATALIE HOPKINS, GROUCHO SINATRA, SEAN GUINESS, GINA DEGENERES, GREG CHAPLIN"
521,LIES TREATMENT,A Fast-Paced Character Study of a Dentist And a Moose who must Defeat a Composer in The First Manned Space Station,Drama,4.99,147,NC-17,"HELEN VOIGHT, JON CHASE, WARREN JACKMAN, WALTER TORN, KENNETH TORN, DAN HARRIS, JOHNNY CAGE"
522,LIFE TWISTED,A Thrilling Reflection of a Teacher And a Composer who must Find a Man in The First Manned Space Station,Comedy,2.99,137,NC-17,"UMA WOOD, MINNIE ZELLWEGER, REESE WEST, DARYL WAHLBERG, CHRISTOPHER WEST, GENE MCKELLEN, MATTHEW CARREY, CHRISTIAN GABLE"
523,LIGHTS DEER,A Unbelieveable Epistle of a Dog And a Woman who must Confront a Moose in The Gulf of Mexico,Classics,0.99,174,R,"MATTHEW JOHANSSON, TIM HACKMAN"
524,LION UNCUT,A Intrepid Display of a Pastry Chef And a Cat who must Kill a A Shark in Ancient China,Comedy,0.99,50,PG,"BELA WALKEN, UMA WOOD, PENELOPE PINKETT"
525,LOATHING LEGALLY,A Boring Epistle of a Pioneer And a Mad Scientist who must Escape a Frisbee in The Gulf of Mexico,Classics,0.99,140,R,"AUDREY OLIVIER, MORGAN HOPKINS, GARY PHOENIX, GRETA KEITEL, SUSAN DAVIS"
526,LOCK REAR,A Thoughtful Character Study of a Squirrel And a Technical Writer who must Outrace a Student in Ancient Japan,Travel,2.99,120,R,"HARVEY HOPE, WALTER TORN"
527,LOLA AGENT,A Astounding Tale of a Mad Scientist And a Husband who must Redeem a Database Administrator in Ancient Japan,Horror,4.99,85,PG,"SCARLETT DAMON, TOM MIRANDA, LUCILLE TRACY, GEOFFREY HESTON, KIM ALLEN, WOODY JOLIE"
528,LOLITA WORLD,A Thrilling Drama of a Girl And a Robot who must Redeem a Waitress in An Abandoned Mine Shaft,Family,2.99,155,NC-17,UMA WOOD
529,LONELY ELEPHANT,A Intrepid Story of a Student And a Dog who must Challenge a Explorer in Soviet Georgia,Comedy,2.99,67,G,"EWAN GOODING, RIP CRAWFORD, KENNETH PALTROW, BEN WILLIS, JAMES PITT, ALAN DREYFUSS, GROUCHO WILLIAMS, VAL BOLGER, CHARLIZE DENCH, ROCK DUKAKIS, WALTER TORN, SEAN GUINESS"
530,LORD ARIZONA,A Action-Packed Display of a Frisbee And a Pastry Chef who must Pursue a Crocodile in A Jet Boat,Action,2.99,108,PG-13,"MORGAN WILLIAMS, SIDNEY CROWE, JULIANNE DENCH, GROUCHO SINATRA, KIRSTEN PALTROW, CHRISTIAN GABLE"
531,LOSE INCH,A Stunning Reflection of a Student And a Technical Writer who must Battle a Butler in The First Manned Space Station,Foreign,0.99,137,R,"HARRISON BALE, REESE WEST, MERYL ALLEN, LUCILLE TRACY"
532,LOSER HUSTLER,A Stunning Drama of a Robot And a Feminist who must Outgun a Butler in Nigeria,Sports,4.99,80,PG,"MATTHEW JOHANSSON, ZERO CAGE, WOODY HOFFMAN, ADAM GRANT, VIVIEN BASINGER"
533,LOST BIRD,A Emotional Character Study of a Robot And a A Shark who must Defeat a Technical Writer in A Manhattan Penthouse,Foreign,2.99,98,PG-13,"CUBA BIRCH, KENNETH TORN, KIRK JOVOVICH"
534,LOUISIANA HARRY,A Lacklusture Drama of a Girl And a Technical Writer who must Redeem a Monkey in A Shark Tank,Family,0.99,70,PG-13,"JAYNE SILVERSTONE, GINA DEGENERES, HENRY BERRY"
535,LOVE SUICIDES,A Brilliant Panorama of a Hunter And a Explorer who must Pursue a Dentist in An Abandoned Fun House,Horror,0.99,181,R,"GRETA MALDEN, JOHNNY LOLLOBRIGIDA, TOM MIRANDA, CHRISTIAN NEESON"
536,LOVELY JINGLE,A Fanciful Yarn of a Crocodile And a Forensic Psychologist who must Discover a Crocodile in The Outback,Classics,2.99,65,PG,"ELVIS MARX, DAN TORN, VIVIEN BERGEN, MARY KEITEL, MINNIE KILMER, SANDRA KILMER"
537,LOVER TRUMAN,A Emotional Yarn of a Robot And a Boy who must Outgun a Technical Writer in A U-Boat,Classics,2.99,75,G,"REESE KILMER, THORA TEMPLE, LISA MONROE, MENA HOPPER, MILLA KEITEL, CHRISTIAN NEESON, VIVIEN BERGEN"
538,LOVERBOY ATTACKS,A Boring Story of a Car And a Butler who must Build a Girl in Soviet Georgia,New,0.99,162,PG-13,"LUCILLE TRACY, KEVIN BLOOM, PARKER GOLDBERG, CARY MCCONAUGHEY, MORGAN MCDORMAND, ADAM HOPPER, GROUCHO WILLIAMS, RENEE BALL, THORA TEMPLE"
539,LUCK OPUS,A Boring Display of a Moose And a Squirrel who must Outrace a Teacher in A Shark Tank,Drama,2.99,152,NC-17,"ED CHASE, SUSAN DAVIS, SCARLETT BENING, JANE JACKMAN, GEOFFREY HESTON, MATTHEW CARREY"
540,LUCKY FLYING,A Lacklusture Character Study of a A Shark And a Man who must Find a Forensic Psychologist in A U-Boat,Music,2.99,97,PG-13,"KARL BERRY, PARKER GOLDBERG, JAMES PITT, KENNETH TORN, JIM MOSTEL, EWAN GOODING, JADA RYDER, ANGELA WITHERSPOON, JULIA MCQUEEN, NICK WAHLBERG"
541,LUKE MUMMY,A Taut Character Study of a Boy And a Robot who must Redeem a Mad Scientist in Ancient India,Animation,2.99,74,NC-17,"ANGELA HUDSON, CHRISTIAN AKROYD, CUBA OLIVIER, BELA WALKEN, JULIA FAWCETT, MARY KEITEL, JOHN SUVARI, RITA REYNOLDS, BURT POSEY"
542,LUST LOCK,A Fanciful Panorama of a Hunter And a Dentist who must Meet a Secret Agent in The Sahara Desert,Action,2.99,52,G,"ED MANSFIELD, JAYNE NOLTE, MATTHEW CARREY, ANNE CRONYN, CHARLIZE DENCH, SEAN GUINESS, SALMA NOLTE"
543,MADIGAN DORADO,A Astounding Character Study of a A Shark And a A Shark who must Discover a Crocodile in The Outback,Travel,4.99,116,R,"GENE MCKELLEN, JON CHASE, KIRSTEN AKROYD, RAY JOHANSSON, MILLA KEITEL, MINNIE ZELLWEGER"
544,MADISON TRAP,A Awe-Inspiring Reflection of a Monkey And a Dentist who must Overcome a Pioneer in A U-Boat,Documentary,2.99,147,R,"JODIE DEGENERES, RIP CRAWFORD, THORA TEMPLE, GREGORY GOODING, WALTER TORN"
545,MADNESS ATTACKS,A Fanciful Tale of a Squirrel And a Boat who must Defeat a Crocodile in The Gulf of Mexico,Foreign,0.99,178,PG-13,"KIRSTEN AKROYD, FRANCES DAY-LEWIS, SCARLETT DAMON, SUSAN DAVIS, FRANCES TOMEI, HUMPHREY WILLIS, MARY KEITEL"
546,MADRE GABLES,A Intrepid Panorama of a Sumo Wrestler And a Forensic Psychologist who must Discover a Moose in The First Manned Space Station,Games,2.99,98,PG-13,"PENELOPE PINKETT, MATTHEW CARREY, TOM MIRANDA, DARYL WAHLBERG"
547,MAGIC MALLRATS,A Touching Documentary of a Pastry Chef And a Pastry Chef who must Build a Mad Scientist in California,Children,0.99,117,PG,"KIRSTEN AKROYD, BURT POSEY, TOM MCKELLEN, ALEC WAYNE"
548,MAGNIFICENT CHITTY,A Insightful Story of a Teacher And a Hunter who must Face a Mad Cow in California,Classics,2.99,53,R,"CUBA BIRCH, RENEE BALL, GINA DEGENERES, GARY PENN, FRED COSTNER, KENNETH TORN, GREG CHAPLIN"
549,MAGNOLIA FORRESTER,A Thoughtful Documentary of a Composer And a Explorer who must Conquer a Dentist in New Orleans,Action,0.99,171,PG-13,"LAURA BRODY, AUDREY BAILEY, OLYMPIA PFEIFFER, GRETA KEITEL, GROUCHO SINATRA, CHRISTIAN AKROYD, SANDRA KILMER"
550,MAGUIRE APACHE,A Fast-Paced Reflection of a Waitress And a Hunter who must Defeat a Forensic Psychologist in A Baloon,Family,2.99,74,NC-17,"NICK WAHLBERG, ALAN DREYFUSS, RENEE TRACY, SEAN WILLIAMS"
551,MAIDEN HOME,A Lacklusture Saga of a Moose And a Teacher who must Kill a Forensic Psychologist in A MySQL Convention,New,4.99,138,PG,"DARYL WAHLBERG, GREGORY GOODING, JAYNE NOLTE, KENNETH TORN, WOODY JOLIE, HENRY BERRY, CHRISTIAN AKROYD, WOODY HOFFMAN"
552,MAJESTIC FLOATS,A Thrilling Character Study of a Moose And a Student who must Escape a Butler in The First Manned Space Station,Documentary,0.99,130,PG,"NATALIE HOPKINS, JOE SWANK, JULIA ZELLWEGER, ED MANSFIELD, GROUCHO SINATRA"
553,MAKER GABLES,A Stunning Display of a Moose And a Database Administrator who must Pursue a Composer in A Jet Boat,Children,0.99,136,PG-13,"LUCILLE DEE, RITA REYNOLDS, KEVIN GARLAND, CUBA ALLEN, MEG HAWKE, RALPH CRUZ, MARY TANDY, VAL BOLGER, CUBA OLIVIER, KIRSTEN AKROYD, CHRISTIAN AKROYD"
554,MALKOVICH PET,A Intrepid Reflection of a Waitress And a A Shark who must Kill a Squirrel in The Outback,Classics,2.99,159,G,"JADA RYDER, MATTHEW JOHANSSON, FAY WINSLET, LAURENCE BULLOCK, MICHAEL BOLGER, GRACE MOSTEL, REESE WEST"
555,MALLRATS UNITED,A Thrilling Yarn of a Waitress And a Dentist who must Find a Hunter in A Monastery,Comedy,0.99,133,PG,"CAMERON ZELLWEGER, VAL BOLGER, NICK WAHLBERG, VIVIEN BASINGER, MARY KEITEL"
556,MALTESE HOPE,A Fast-Paced Documentary of a Crocodile And a Sumo Wrestler who must Conquer a Explorer in California,Games,4.99,127,PG-13,ANGELA HUDSON
557,MANCHURIAN CURTAIN,A Stunning Tale of a Mad Cow And a Boy who must Battle a Boy in Berlin,Family,2.99,177,PG,"ALBERT NOLTE, RAY JOHANSSON"
558,MANNEQUIN WORST,A Astounding Saga of a Mad Cow And a Pastry Chef who must Discover a Husband in Ancient India,New,2.99,71,PG-13,"GENE HOPKINS, SIDNEY CROWE, ANNE CRONYN, MINNIE ZELLWEGER, CUBA ALLEN"
559,MARRIED GO,A Fanciful Story of a Womanizer And a Dog who must Face a Forensic Psychologist in The Sahara Desert,Sci-Fi,2.99,114,G,"GOLDIE BRODY, GROUCHO DUNST, FRANCES DAY-LEWIS"
560,MARS ROMAN,A Boring Drama of a Car And a Dog who must Succumb a Madman in Soviet Georgia,Games,0.99,62,NC-17,"BELA WALKEN, RIVER DEAN, OLYMPIA PFEIFFER, MICHAEL BOLGER, CUBA BIRCH, JAYNE SILVERSTONE, ADAM GRANT"
561,MASK PEACH,A Boring Character Study of a Student And a Robot who must Meet a Woman in California,New,2.99,123,NC-17,"WARREN NOLTE, LUCILLE DEE, LAURA BRODY, JEFF SILVERSTONE, RENEE BALL, SIDNEY CROWE, MEG HAWKE, WOODY JOLIE, GARY PENN, DAN TORN, NICK WAHLBERG"
562,MASKED BUBBLE,A Fanciful Documentary of a Pioneer And a Boat who must Pursue a Pioneer in An Abandoned Mine Shaft,Music,0.99,151,PG-13,"AUDREY BAILEY, GARY PENN, ADAM HOPPER"
563,MASSACRE USUAL,A Fateful Reflection of a Waitress And a Crocodile who must Challenge a Forensic Psychologist in California,Games,4.99,165,R,"GENE MCKELLEN, SPENCER DEPP, FAY WINSLET"
564,MASSAGE IMAGE,A Fateful Drama of a Frisbee And a Crocodile who must Vanquish a Dog in The First Manned Space Station,Animation,2.99,161,PG,"CHARLIZE DENCH, RIP CRAWFORD, KEVIN BLOOM, SCARLETT DAMON, ALAN DREYFUSS, KIRSTEN AKROYD, CATE MCQUEEN, MORGAN WILLIAMS, KENNETH HOFFMAN"
565,MATRIX SNOWMAN,A Action-Packed Saga of a Womanizer And a Woman who must Overcome a Student in California,Foreign,4.99,56,PG-13,"RUSSELL BACALL, GARY PENN, SANDRA PECK"
566,MAUDE MOD,A Beautiful Documentary of a Forensic Psychologist And a Cat who must Reach a Astronaut in Nigeria,Foreign,0.99,72,R,"ED GUINESS, JAMES PITT, ROCK DUKAKIS, CARY MCCONAUGHEY, OLYMPIA PFEIFFER, GROUCHO DUNST"
567,MEET CHOCOLATE,A Boring Documentary of a Dentist And a Butler who must Confront a Monkey in A MySQL Convention,Foreign,2.99,80,G,"GROUCHO WILLIAMS, PARKER GOLDBERG, ZERO CAGE, TIM HACKMAN, WARREN JACKMAN, WARREN NOLTE"
568,MEMENTO ZOOLANDER,A Touching Epistle of a Squirrel And a Explorer who must Redeem a Pastry Chef in The Sahara Desert,Comedy,4.99,77,NC-17,"MARY KEITEL, ALBERT NOLTE, SUSAN DAVIS, KIRSTEN AKROYD, ANGELINA ASTAIRE, TOM MIRANDA"
569,MENAGERIE RUSHMORE,A Unbelieveable Panorama of a Composer And a Butler who must Overcome a Database Administrator in The First Manned Space Station,Animation,2.99,147,G,"BURT DUKAKIS, RAY JOHANSSON"
570,MERMAID INSECTS,A Lacklusture Drama of a Waitress And a Husband who must Fight a Husband in California,Sports,4.99,104,NC-17,"EWAN GOODING, GEOFFREY HESTON, MARY KEITEL, FRANCES DAY-LEWIS, SPENCER PECK, WARREN JACKMAN"
571,METAL ARMAGEDDON,A Thrilling Display of a Lumberjack And a Crocodile who must Meet a Monkey in A Baloon Factory,Documentary,2.99,161,PG-13,"MICHAEL BOLGER, ALAN DREYFUSS, KENNETH HOFFMAN, ALBERT JOHANSSON, ANGELA HUDSON, UMA WOOD, JOHNNY LOLLOBRIGIDA, GINA DEGENERES"
572,METROPOLIS COMA,A Emotional Saga of a Database Administrator And a Pastry Chef who must Confront a Teacher in A Baloon Factory,Sci-Fi,2.99,64,PG-13,"JIM MOSTEL, VAL BOLGER, DUSTIN TAUTOU, RAY JOHANSSON, GENE WILLIS, CUBA ALLEN"
573,MICROCOSMOS PARADISE,A Touching Character Study of a Boat And a Student who must Sink a A Shark in Nigeria,Children,2.99,105,PG-13,"KEVIN GARLAND, ELLEN PRESLEY, MENA TEMPLE, HELEN VOIGHT, GRETA MALDEN, JON CHASE"
574,MIDNIGHT WESTWARD,A Taut Reflection of a Husband And a A Shark who must Redeem a Pastry Chef in A Monastery,Action,0.99,86,G,"GRETA MALDEN, JAMES PITT, HUMPHREY GARLAND, MILLA PECK, WOODY HOFFMAN, ADAM GRANT, OPRAH KILMER, GEOFFREY HESTON, GINA DEGENERES"
575,MIDSUMMER GROUNDHOG,A Fateful Panorama of a Moose And a Dog who must Chase a Crocodile in Ancient Japan,Documentary,4.99,48,G,"BELA WALKEN, JADA RYDER"
576,MIGHTY LUCK,A Astounding Epistle of a Mad Scientist And a Pioneer who must Escape a Database Administrator in A MySQL Convention,Documentary,2.99,122,PG,"RUSSELL CLOSE, RIVER DEAN, WHOOPI HURT, JULIANNE DENCH, JESSICA BAILEY, MENA TEMPLE, JULIA BARRYMORE, BELA WALKEN"
577,MILE MULAN,A Lacklusture Epistle of a Cat And a Husband who must Confront a Boy in A MySQL Convention,Sports,0.99,64,PG,"ANGELA HUDSON, MENA TEMPLE, JULIANNE DENCH"
578,MILLION ACE,A Brilliant Documentary of a Womanizer And a Squirrel who must Find a Technical Writer in The Sahara Desert,Classics,4.99,142,PG-13,"JOHN SUVARI, BEN HARRIS, RENEE TRACY, CHRISTIAN AKROYD, SCARLETT DAMON"
579,MINDS TRUMAN,A Taut Yarn of a Mad Scientist And a Crocodile who must Outgun a Database Administrator in A Monastery,Action,4.99,149,PG-13,"CHRIS DEPP, ANNE CRONYN, BURT POSEY, SCARLETT DAMON, MATTHEW CARREY, JULIA ZELLWEGER"
580,MINE TITANS,A Amazing Yarn of a Robot And a Womanizer who must Discover a Forensic Psychologist in Berlin,New,4.99,166,PG-13,"NICK DEGENERES, HUMPHREY GARLAND"
581,MINORITY KISS,A Insightful Display of a Lumberjack And a Sumo Wrestler who must Meet a Man in The Outback,Music,0.99,59,G,VIVIEN BASINGER
582,MIRACLE VIRTUAL,A Touching Epistle of a Butler And a Boy who must Find a Mad Scientist in The Sahara Desert,Animation,2.99,162,PG-13,FRED COSTNER
583,MISSION ZOOLANDER,A Intrepid Story of a Sumo Wrestler And a Teacher who must Meet a A Shark in An Abandoned Fun House,Animation,4.99,164,PG-13,"LUCILLE DEE, PENELOPE CRONYN, TOM MCKELLEN, KEVIN BLOOM, FRED COSTNER"
584,MIXED DOORS,A Taut Drama of a Womanizer And a Lumberjack who must Succumb a Pioneer in Ancient India,Foreign,2.99,180,PG-13,"MICHAEL BOLGER, ALBERT NOLTE, MICHELLE MCCONAUGHEY, CARMEN HUNT, DAN STREEP, IAN TANDY"
585,MOB DUFFEL,A Unbelieveable Documentary of a Frisbee And a Boat who must Meet a Boy in The Canadian Rockies,Drama,0.99,105,G,"CAMERON STREEP, SISSY SOBIESKI, TIM HACKMAN, CHRISTIAN NEESON, MATTHEW LEIGH, GROUCHO DUNST"
586,MOCKINGBIRD HOLLYWOOD,A Thoughtful Panorama of a Man And a Car who must Sink a Composer in Berlin,Action,0.99,60,PG,"JULIA MCQUEEN, ADAM HOPPER, SEAN GUINESS"
587,MOD SECRETARY,A Boring Documentary of a Mad Cow And a Cat who must Build a Lumberjack in New Orleans,Documentary,4.99,77,NC-17,"GOLDIE BRODY, BELA WALKEN, LISA MONROE, WHOOPI HURT, ZERO CAGE, CHRISTIAN GABLE"
588,MODEL FISH,A Beautiful Panorama of a Boat And a Crocodile who must Outrace a Dog in Australia,Children,4.99,175,NC-17,"GENE HOPKINS, UMA WOOD, VAL BOLGER, RICHARD PENN, MERYL GIBSON, HARVEY HOPE, ED GUINESS, MARY KEITEL"
589,MODERN DORADO,A Awe-Inspiring Story of a Butler And a Sumo Wrestler who must Redeem a Boy in New Orleans,Documentary,0.99,74,PG,"JUDY DEAN, LUCILLE TRACY, JAMES PITT, CATE HARRIS, JULIANNE DENCH"
590,MONEY HAROLD,A Touching Tale of a Explorer And a Boat who must Defeat a Robot in Australia,New,2.99,135,PG,"DEBBIE AKROYD, IAN TANDY, JANE JACKMAN, PENELOPE MONROE, GENE WILLIS, BURT DUKAKIS, ALEC WAYNE"
591,MONSOON CAUSE,A Astounding Tale of a Crocodile And a Car who must Outrace a Squirrel in A U-Boat,Games,4.99,182,PG,"NICK STALLONE, MINNIE ZELLWEGER, ALBERT JOHANSSON, WILLIAM HACKMAN, NATALIE HOPKINS"
592,MONSTER SPARTACUS,A Fast-Paced Story of a Waitress And a Cat who must Fight a Girl in Australia,Music,2.99,107,PG,"WARREN JACKMAN, JUDE CRUISE, GRETA KEITEL, KIM ALLEN, ALAN DREYFUSS, JOHN SUVARI, JAYNE SILVERSTONE"
593,MONTEREY LABYRINTH,A Awe-Inspiring Drama of a Monkey And a Composer who must Escape a Feminist in A U-Boat,Horror,0.99,158,G,"KARL BERRY, JULIANNE DENCH, DAN HARRIS, JULIA MCQUEEN, FAY WOOD, ROCK DUKAKIS"
594,MONTEZUMA COMMAND,A Thrilling Reflection of a Waitress And a Butler who must Battle a Butler in A Jet Boat,Action,0.99,126,NC-17,"RICHARD PENN, CUBA OLIVIER"
595,MOON BUNCH,A Beautiful Tale of a Astronaut And a Mad Cow who must Challenge a Cat in A Baloon Factory,Foreign,0.99,83,PG,ANNE CRONYN
596,MOONSHINE CABIN,A Thoughtful Display of a Astronaut And a Feminist who must Chase a Frisbee in A Jet Boat,Games,4.99,171,PG-13,"CARMEN HUNT, JODIE DEGENERES, MATTHEW CARREY, WILLIAM HACKMAN, GREGORY GOODING"
597,MOONWALKER FOOL,A Epic Drama of a Feminist And a Pioneer who must Sink a Composer in New Orleans,Games,4.99,184,G,"DARYL CRAWFORD, UMA WOOD, ZERO CAGE, WOODY HOFFMAN, RAY JOHANSSON, HUMPHREY GARLAND, MARY KEITEL"
598,MOSQUITO ARMAGEDDON,A Thoughtful Character Study of a Waitress And a Feminist who must Build a Teacher in Ancient Japan,Sports,0.99,57,G,"REESE WEST, NICK STALLONE, KIRK JOVOVICH, GOLDIE BRODY"
599,MOTHER OLEANDER,A Boring Tale of a Husband And a Boy who must Fight a Squirrel in Ancient China,Sports,0.99,103,R,"SPENCER PECK, GROUCHO SINATRA, FRANCES DAY-LEWIS, WHOOPI HURT, ANGELA WITHERSPOON"
600,MOTIONS DETAILS,A Awe-Inspiring Reflection of a Dog And a Student who must Kill a Car in An Abandoned Fun House,Horror,0.99,166,PG,"UMA WOOD, BURT DUKAKIS, ELVIS MARX, LAURA BRODY, PENELOPE PINKETT, JIM MOSTEL, WALTER TORN, PENELOPE CRONYN"
601,MOULIN WAKE,A Astounding Story of a Forensic Psychologist And a Cat who must Battle a Teacher in An Abandoned Mine Shaft,Travel,0.99,79,PG-13,"SCARLETT BENING, JESSICA BAILEY, VIVIEN BASINGER"
602,MOURNING PURPLE,A Lacklusture Display of a Waitress And a Lumberjack who must Chase a Pioneer in New Orleans,Sci-Fi,0.99,146,PG,"KENNETH PESCI, ALBERT NOLTE, DARYL CRAWFORD, EWAN GOODING, MERYL GIBSON, WILL WILSON, CHRISTIAN AKROYD"
603,MOVIE SHAKESPEARE,A Insightful Display of a Database Administrator And a Student who must Build a Hunter in Berlin,Family,4.99,53,PG,"RIVER DEAN, CAMERON ZELLWEGER, RUSSELL BACALL, MORGAN WILLIAMS, GINA DEGENERES, FAY KILMER, CAMERON STREEP, HELEN VOIGHT"
604,MULAN MOON,A Emotional Saga of a Womanizer And a Pioneer who must Overcome a Dentist in A Baloon,Comedy,0.99,160,G,"NICK STALLONE, ANGELINA ASTAIRE, MATTHEW CARREY, JULIA FAWCETT, GRETA MALDEN"
