FID,title,description,category,price,length,rating,actors
242,DOOM DANCING,A Astounding Panorama of a Car And a Mad Scientist who must Battle a Lumberjack in A MySQL Convention,Comedy,0.99,68,R,"NICK STALLONE, CHRISTIAN AKROYD, JESSICA BAILEY, MAE HOFFMAN, WOODY JOLIE, WARREN NOLTE, CHRIS DEPP, CAMERON STREEP"
243,DOORS PRESIDENT,A Awe-Inspiring Display of a Squirrel And a Woman who must Overcome a Boy in The Gulf of Mexico,Animation,4.99,49,NC-17,"REESE WEST, KIM ALLEN, ED MANSFIELD, GENE HOPKINS, SYLVESTER DERN, CHRISTIAN AKROYD, NATALIE HOPKINS, KARL BERRY, LUCILLE TRACY"
244,DORADO NOTTING,A Action-Packed Tale of a Sumo Wrestler And a A Shark who must Meet a Frisbee in California,Music,4.99,139,NC-17,"FAY WOOD, GENE WILLIS, JESSICA BAILEY, AUDREY OLIVIER"
245,DOUBLE WRATH,A Thoughtful Yarn of a Womanizer And a Dog who must Challenge a Madman in The Gulf of Mexico,Animation,0.99,177,R,"GARY PENN, CARY MCCONAUGHEY, KEVIN BLOOM, BURT DUKAKIS, FRANCES DAY-LEWIS, JULIANNE DENCH, HARRISON BALE, DARYL WAHLBERG"
246,DOUBTFIRE LABYRINTH,A Intrepid Panorama of a Butler And a Composer who must Meet a Mad Cow in The Sahara Desert,Foreign,4.99,154,R,"RENEE TRACY, HARRISON BALE, JULIANNE DENCH, SCARLETT BENING, KENNETH HOFFMAN"
247,DOWNHILL ENOUGH,A Emotional Tale of a Pastry Chef And a Forensic Psychologist who must Succumb a Monkey in The Sahara Desert,Comedy,0.99,47,G,"WOODY JOLIE, BEN WILLIS, DARYL CRAWFORD, HARVEY HOPE"
248,DOZEN LION,A Taut Drama of a Cat And a Girl who must Defeat a Frisbee in The Canadian Rockies,Documentary,4.99,177,NC-17,"KENNETH HOFFMAN, LAURA BRODY, NATALIE HOPKINS, BEN HARRIS, JADA RYDER, CAMERON WRAY"
249,DRACULA CRYSTAL,A Thrilling Reflection of a Feminist And a Cat who must Find a Frisbee in An Abandoned Fun House,Classics,0.99,176,G,"CAMERON WRAY, MORGAN WILLIAMS, REESE WEST, NICK WAHLBERG, JODIE DEGENERES, CARMEN HUNT, IAN TANDY, MICHELLE MCCONAUGHEY, SEAN WILLIAMS, BEN WILLIS, GREG CHAPLIN, MORGAN HOPKINS, DARYL CRAWFORD"
250,DRAGON SQUAD,A Taut Reflection of a Boy And a Waitress who must Outgun a Teacher in Ancient China,Action,0.99,170,NC-17,"ANNE CRONYN, SPENCER PECK, JIM MOSTEL, SPENCER DEPP, SUSAN DAVIS, ALBERT NOLTE, GENE HOPKINS, ED GUINESS"
251,DRAGONFLY STRANGERS,A Boring Documentary of a Pioneer And a Man who must Vanquish a Man in Nigeria,New,4.99,133,NC-17,"FAY WINSLET, ANGELINA ASTAIRE, CHRISTIAN GABLE"
252,DREAM PICKUP,A Epic Display of a Car And a Composer who must Overcome a Forensic Psychologist in The Gulf of Mexico,Action,2.99,135,PG,"HUMPHREY WILLIS, JON CHASE, JODIE DEGENERES, MILLA PECK"
253,DRIFTER COMMANDMENTS,A Epic Reflection of a Womanizer And a Squirrel who must Discover a Husband in A Jet Boat,Action,4.99,61,PG-13,"VIVIEN BERGEN, KIRSTEN PALTROW, VAL BOLGER, HENRY BERRY, AL GARLAND, AUDREY BAILEY, SPENCER PECK"
254,DRIVER ANNIE,A Lacklusture Character Study of a Butler And a Car who must Redeem a Boat in An Abandoned Fun House,Sports,2.99,159,PG-13,"UMA WOOD, FAY WINSLET, SANDRA KILMER, MORGAN MCDORMAND, CHARLIZE DENCH, MORGAN WILLIAMS, PARKER GOLDBERG, CHRISTIAN AKROYD"
255,DRIVING POLISH,A Action-Packed Yarn of a Feminist And a Technical Writer who must Sink a Boat in An Abandoned Mine Shaft,Music,4.99,175,NC-17,"MATTHEW JOHANSSON, VIVIEN BERGEN, SUSAN DAVIS, WILL WILSON, NICK DEGENERES, PENELOPE MONROE, RIP WINSLET"
256,DROP WATERFRONT,A Fanciful Documentary of a Husband And a Explorer who must Reach a Madman in Ancient China,Sports,4.99,178,R,"BETTE NICHOLSON, ED MANSFIELD, FRANCES TOMEI, CAMERON STREEP, MEG HAWKE, JESSICA BAILEY, MENA TEMPLE, JUDY DEAN"
258,DRUMS DYNAMITE,A Epic Display of a Crocodile And a Crocodile who must Confront a Dog in An Abandoned Amusement Park,Horror,0.99,96,PG,"JEFF SILVERSTONE, JUDE CRUISE, LUCILLE DEE, MORGAN HOPKINS, REESE WEST, WHOOPI HURT, VIVIEN BERGEN"
259,DUCK RACER,A Lacklusture Yarn of a Teacher And a Squirrel who must Overcome a Dog in A Shark Tank,Animation,2.99,116,NC-17,"PENELOPE CRONYN, WOODY HOFFMAN"
260,DUDE BLINDNESS,A Stunning Reflection of a Husband And a Lumberjack who must Face a Frisbee in An Abandoned Fun House,Sports,4.99,132,G,"GROUCHO SINATRA, SANDRA PECK, VAL BOLGER, RALPH CRUZ, SCARLETT DAMON, SCARLETT BENING, ANGELA WITHERSPOON"
261,DUFFEL APOCALYPSE,A Emotional Display of a Boat And a Explorer who must Challenge a Madman in A MySQL Convention,Documentary,0.99,171,G,"EWAN GOODING, GROUCHO SINATRA, CARY MCCONAUGHEY"
262,DUMBO LUST,A Touching Display of a Feminist And a Dentist who must Conquer a Husband in The Gulf of Mexico,Family,0.99,119,NC-17,"SANDRA PECK, EWAN GOODING, HENRY BERRY, ED MANSFIELD, MAE HOFFMAN, FAY WOOD, RALPH CRUZ, SEAN GUINESS, MARY KEITEL"
263,DURHAM PANKY,A Brilliant Panorama of a Girl And a Boy who must Face a Mad Scientist in An Abandoned Mine Shaft,Sports,4.99,154,R,"SUSAN DAVIS, BEN WILLIS, FRANCES TOMEI, MILLA KEITEL, MATTHEW JOHANSSON, WOODY HOFFMAN, SCARLETT BENING, MORGAN WILLIAMS, FAY WOOD"
264,DWARFS ALTER,A Emotional Yarn of a Girl And a Dog who must Challenge a Composer in Ancient Japan,Games,2.99,101,G,MARY KEITEL
265,DYING MAKER,A Intrepid Tale of a Boat And a Monkey who must Kill a Cat in California,Comedy,4.99,168,PG,"MICHAEL BOLGER, GROUCHO SINATRA"
266,DYNAMITE TARZAN,A Intrepid Documentary of a Forensic Psychologist And a Mad Scientist who must Face a Explorer in A U-Boat,Classics,0.99,141,PG-13,"CUBA BIRCH, EWAN GOODING, JULIANNE DENCH, CHARLIZE DENCH, BOB FAWCETT"
267,EAGLES PANKY,A Thoughtful Story of a Car And a Boy who must Find a A Shark in The Sahara Desert,New,4.99,140,NC-17,"FRANCES DAY-LEWIS, MAE HOFFMAN, JUDE CRUISE, FRED COSTNER, CHRIS DEPP, SCARLETT DAMON"
268,EARLY HOME,A Amazing Panorama of a Mad Scientist And a Husband who must Meet a Woman in The Outback,Animation,4.99,96,NC-17,"MENA TEMPLE, SCARLETT DAMON, BEN WILLIS, WALTER TORN, MORGAN WILLIAMS, DAN TORN"
269,EARRING INSTINCT,A Stunning Character Study of a Dentist And a Mad Cow who must Find a Teacher in Nigeria,Family,0.99,98,R,"RITA REYNOLDS, HARVEY HOPE, LUCILLE TRACY, FRED COSTNER, MAE HOFFMAN"
270,EARTH VISION,A Stunning Drama of a Butler And a Madman who must Outrace a Womanizer in Ancient India,New,0.99,85,NC-17,"JAYNE NOLTE, RICHARD PENN, KENNETH TORN"
271,EASY GLADIATOR,A Fateful Story of a Monkey And a Girl who must Overcome a Pastry Chef in Ancient India,Action,4.99,148,G,"FRED COSTNER, MATTHEW LEIGH, ED MANSFIELD"
272,EDGE KISSING,A Beautiful Yarn of a Composer And a Mad Cow who must Redeem a Mad Scientist in A Jet Boat,Drama,4.99,153,NC-17,"ANGELA WITHERSPOON, JAYNE NEESON, CUBA BIRCH"
273,EFFECT GLADIATOR,A Beautiful Display of a Pastry Chef And a Pastry Chef who must Outgun a Forensic Psychologist in A Manhattan Penthouse,Family,0.99,107,PG,"JULIA MCQUEEN, LISA MONROE, OLYMPIA PFEIFFER, RENEE TRACY, JULIA BARRYMORE, NICK STALLONE, ALEC WAYNE"
274,EGG IGBY,A Beautiful Documentary of a Boat And a Sumo Wrestler who must Succumb a Database Administrator in The First Manned Space Station,Documentary,2.99,67,PG,"TOM MCKELLEN, LUCILLE TRACY, MERYL GIBSON, NATALIE HOPKINS, OPRAH KILMER"
275,EGYPT TENENBAUMS,A Intrepid Story of a Madman And a Secret Agent who must Outrace a Astronaut in An Abandoned Amusement Park,Horror,0.99,85,PG,"CUBA OLIVIER, CHRIS DEPP, SUSAN DAVIS, GARY PENN, KENNETH TORN"
276,ELEMENT FREDDY,A Awe-Inspiring Reflection of a Waitress And a Squirrel who must Kill a Mad Cow in A Jet Boat,Comedy,4.99,115,NC-17,"ANGELA HUDSON, KIRK JOVOVICH, MERYL GIBSON, BELA WALKEN"
277,ELEPHANT TROJAN,A Beautiful Panorama of a Lumberjack And a Forensic Psychologist who must Overcome a Frisbee in A Baloon,Horror,4.99,126,PG-13,"HARRISON BALE, CAMERON STREEP, PENELOPE GUINESS, VAL BOLGER, GINA DEGENERES"
278,ELF MURDER,A Action-Packed Story of a Frisbee And a Woman who must Reach a Girl in An Abandoned Mine Shaft,Music,4.99,155,NC-17,"ALBERT JOHANSSON, CAMERON WRAY, WARREN NOLTE, GENE HOPKINS, AUDREY BAILEY"
279,ELIZABETH SHANE,A Lacklusture Display of a Womanizer And a Dog who must Face a Sumo Wrestler in Ancient Japan,Sports,4.99,152,NC-17,"DAN TORN, BEN WILLIS, OPRAH KILMER"
280,EMPIRE MALKOVICH,A Amazing Story of a Feminist And a Cat who must Face a Car in An Abandoned Fun House,Children,0.99,177,G,"RICHARD PENN, SIDNEY CROWE, ELLEN PRESLEY, RALPH CRUZ, RAY JOHANSSON, DAN TORN, HELEN VOIGHT, FRED COSTNER, CUBA OLIVIER"
281,ENCINO ELF,A Astounding Drama of a Feminist And a Teacher who must Confront a Husband in A Baloon,Games,0.99,143,G,"JAMES PITT, HARVEY HOPE, BEN WILLIS, KIRSTEN PALTROW, ZERO CAGE, SYLVESTER DERN"
282,ENCOUNTERS CURTAIN,A Insightful Epistle of a Pastry Chef And a Womanizer who must Build a Boat in New Orleans,Drama,0.99,92,NC-17,"ANNE CRONYN, ALEC WAYNE, MERYL GIBSON, EWAN GOODING"
283,ENDING CROWDS,A Unbelieveable Display of a Dentist And a Madman who must Vanquish a Squirrel in Berlin,New,0.99,85,NC-17,"CHRISTOPHER WEST, SIDNEY CROWE, MARY TANDY, BURT DUKAKIS, ZERO CAGE"
284,ENEMY ODDS,A Fanciful Panorama of a Mad Scientist And a Woman who must Pursue a Astronaut in Ancient India,Music,4.99,77,NC-17,"BELA WALKEN, EWAN GOODING, VIVIEN BERGEN, LIZA BERGMAN"
285,ENGLISH BULWORTH,A Intrepid Epistle of a Pastry Chef And a Pastry Chef who must Pursue a Crocodile in Ancient China,Sci-Fi,0.99,51,PG-13,"MENA TEMPLE, FAY WOOD, JAYNE NOLTE, MATTHEW LEIGH, PENELOPE PINKETT"
286,ENOUGH RAGING,A Astounding Character Study of a Boat And a Secret Agent who must Find a Mad Cow in The Sahara Desert,Travel,2.99,158,NC-17,"JULIANNE DENCH, SEAN WILLIAMS, JOHNNY LOLLOBRIGIDA, SANDRA PECK, MICHAEL BOLGER, MATTHEW CARREY, KEVIN GARLAND, RICHARD PENN, AL GARLAND"
287,ENTRAPMENT SATISFACTION,A Thoughtful Panorama of a Hunter And a Teacher who must Reach a Mad Cow in A U-Boat,Action,0.99,176,R,"PENELOPE CRONYN, FRANCES DAY-LEWIS, WOODY HOFFMAN, FRED COSTNER"
288,ESCAPE METROPOLIS,A Taut Yarn of a Astronaut And a Technical Writer who must Outgun a Boat in New Orleans,Travel,2.99,167,R,"NATALIE HOPKINS, ED MANSFIELD, FRANCES TOMEI, JOHNNY LOLLOBRIGIDA"
289,EVE RESURRECTION,A Awe-Inspiring Yarn of a Pastry Chef And a Database Administrator who must Challenge a Teacher in A Baloon,New,4.99,66,G,"SUSAN DAVIS, SCARLETT BENING, KENNETH HOFFMAN, GENE MCKELLEN, ROCK DUKAKIS, ED CHASE"
290,EVERYONE CRAFT,A Fateful Display of a Waitress And a Dentist who must Reach a Butler in Nigeria,Foreign,0.99,163,PG,"MINNIE ZELLWEGER, GOLDIE BRODY, MICHELLE MCCONAUGHEY, JAMES PITT, WOODY JOLIE"
291,EVOLUTION ALTER,A Fanciful Character Study of a Feminist And a Madman who must Find a Explorer in A Baloon Factory,Sports,0.99,174,PG-13,"ELVIS MARX, RAY JOHANSSON, ANGELA WITHERSPOON, GRETA MALDEN, ED GUINESS, BURT TEMPLE"
292,EXCITEMENT EVE,A Brilliant Documentary of a Monkey And a Car who must Conquer a Crocodile in A Shark Tank,Action,0.99,51,G,"KENNETH PALTROW, GINA DEGENERES, SANDRA PECK, VIVIEN BERGEN, PENELOPE PINKETT, SUSAN DAVIS, MORGAN HOPKINS, GRACE MOSTEL"
293,EXORCIST STING,A Touching Drama of a Dog And a Sumo Wrestler who must Conquer a Mad Scientist in Berlin,Sports,2.99,167,G,"GOLDIE BRODY, ANGELA WITHERSPOON, KIM ALLEN, VIVIEN BASINGER, GREGORY GOODING"
294,EXPECATIONS NATURAL,A Amazing Drama of a Butler And a Husband who must Reach a A Shark in A U-Boat,Travel,4.99,138,PG-13,"ELVIS MARX, DARYL WAHLBERG, LAURENCE BULLOCK"
295,EXPENDABLE STALLION,A Amazing Character Study of a Mad Cow And a Squirrel who must Discover a Hunter in A U-Boat,Documentary,0.99,97,PG,"DUSTIN TAUTOU, JAYNE NEESON, FRANCES DAY-LEWIS, FAY WINSLET"
296,EXPRESS LONELY,A Boring Drama of a Astronaut And a Boat who must Face a Boat in California,Sci-Fi,2.99,178,R,"PARKER GOLDBERG, RIP WINSLET, MINNIE ZELLWEGER, ALBERT JOHANSSON, OLYMPIA PFEIFFER, GREGORY GOODING, SEAN WILLIAMS, ALEC WAYNE"
297,EXTRAORDINARY CONQUERER,A Stunning Story of a Dog And a Feminist who must Face a Forensic Psychologist in Berlin,Classics,2.99,122,G,"MINNIE ZELLWEGER, CHRIS BRIDGES, LIZA BERGMAN, FAY WOOD, NICK DEGENERES, RENEE BALL, HENRY BERRY"
298,EYES DRIVING,A Thrilling Story of a Cat And a Waitress who must Fight a Explorer in The Outback,Sci-Fi,2.99,172,PG-13,"MICHAEL BENING, JAYNE SILVERSTONE, DAN HARRIS, RENEE TRACY, FAY WINSLET"
299,FACTORY DRAGON,A Action-Packed Saga of a Teacher And a Frisbee who must Escape a Lumberjack in The Sahara Desert,Travel,0.99,144,PG-13,"MENA HOPPER, MERYL GIBSON, CATE MCQUEEN, SISSY SOBIESKI, HENRY BERRY, MAE HOFFMAN"
300,FALCON VOLUME,A Fateful Saga of a Sumo Wrestler And a Hunter who must Redeem a A Shark in New Orleans,Animation,4.99,102,PG-13,"KENNETH PALTROW, SALMA NOLTE, ED MANSFIELD, MARY TANDY"
301,FAMILY SWEET,A Epic Documentary of a Teacher And a Boy who must Escape a Woman in Berlin,Horror,0.99,155,R,"DEBBIE AKROYD, MATTHEW CARREY, KENNETH HOFFMAN, SANDRA PECK, BURT POSEY, PENELOPE PINKETT, FAY WOOD, DARYL WAHLBERG, GROUCHO SINATRA"
302,FANTASIA PARK,A Thoughtful Documentary of a Mad Scientist And a A Shark who must Outrace a Feminist in Australia,Games,2.99,131,G,"WARREN NOLTE, GROUCHO WILLIAMS, HARRISON BALE"
303,FANTASY TROOPERS,A Touching Saga of a Teacher And a Monkey who must Overcome a Secret Agent in A MySQL Convention,Action,0.99,58,PG-13,"GREG CHAPLIN, NATALIE HOPKINS, GRETA MALDEN, CHRISTOPHER WEST, JON CHASE, BELA WALKEN, MARY KEITEL, IAN TANDY, SEAN GUINESS"
304,FARGO GANDHI,A Thrilling Reflection of a Pastry Chef And a Crocodile who must Reach a Teacher in The Outback,Children,2.99,130,G,"SCARLETT DAMON, KENNETH PESCI, CHRISTOPHER WEST, MORGAN WILLIAMS, MICHELLE MCCONAUGHEY"
305,FATAL HAUNTED,A Beautiful Drama of a Student And a Secret Agent who must Confront a Dentist in Ancient Japan,New,2.99,91,PG,"MILLA PECK, JODIE DEGENERES, ANGELA HUDSON, MORGAN MCDORMAND, FAY WINSLET, WILL WILSON"
306,FEATHERS METAL,A Thoughtful Yarn of a Monkey And a Teacher who must Find a Dog in Australia,Games,0.99,104,PG-13,"CHARLIZE DENCH, SCARLETT BENING, JAYNE NOLTE, NICK DEGENERES, MILLA PECK, NATALIE HOPKINS, CHRISTIAN AKROYD, KENNETH PALTROW, WOODY JOLIE"
307,FELLOWSHIP AUTUMN,A Lacklusture Reflection of a Dentist And a Hunter who must Meet a Teacher in A Baloon,Travel,4.99,77,NC-17,"FAY KILMER, SALMA NOLTE, MENA TEMPLE, DAN HARRIS, CHRISTIAN NEESON, RAY JOHANSSON, CHRISTOPHER WEST"
308,FERRIS MOTHER,A Touching Display of a Frisbee And a Frisbee who must Kill a Girl in The Gulf of Mexico,Comedy,2.99,142,PG,SISSY SOBIESKI
309,FEUD FROGMEN,A Brilliant Reflection of a Database Administrator And a Mad Cow who must Chase a Woman in The Canadian Rockies,Family,0.99,98,R,"PENELOPE CRONYN, TOM MIRANDA, TIM HACKMAN, MARY KEITEL"
310,FEVER EMPIRE,A Insightful Panorama of a Cat And a Boat who must Defeat a Boat in The Gulf of Mexico,Games,4.99,158,R,"HELEN VOIGHT, AUDREY BAILEY, FAY WINSLET"
311,FICTION CHRISTMAS,A Emotional Yarn of a A Shark And a Student who must Battle a Robot in An Abandoned Mine Shaft,Foreign,0.99,72,PG,"ADAM HOPPER, MARY KEITEL, ROCK DUKAKIS, MATTHEW CARREY, LISA MONROE, CUBA ALLEN, ALEC WAYNE, KEVIN BLOOM"
312,FIDDLER LOST,A Boring Tale of a Squirrel And a Dog who must Challenge a Madman in The Gulf of Mexico,Sci-Fi,4.99,75,R,"SPENCER PECK, JAMES PITT, FRANCES DAY-LEWIS, TIM HACKMAN, IAN TANDY, ANGELA WITHERSPOON, CATE MCQUEEN, SCARLETT BENING, RUSSELL BACALL, MEG HAWKE, DARYL WAHLBERG"
313,FIDELITY DEVIL,A Awe-Inspiring Drama of a Technical Writer And a Composer who must Reach a Pastry Chef in A U-Boat,Horror,4.99,118,G,"HELEN VOIGHT, ALAN DREYFUSS, PENELOPE CRONYN, RUSSELL CLOSE"
314,FIGHT JAWBREAKER,A Intrepid Panorama of a Womanizer And a Girl who must Escape a Girl in A Manhattan Penthouse,Animation,0.99,91,R,"MERYL GIBSON, NICK WAHLBERG, ALBERT JOHANSSON"
315,FINDING ANACONDA,A Fateful Tale of a Database Administrator And a Girl who must Battle a Squirrel in New Orleans,Family,0.99,156,R,"MATTHEW LEIGH, SIDNEY CROWE, FRANCES DAY-LEWIS, RIP WINSLET, CUBA BIRCH"
316,FIRE WOLVES,A Intrepid Documentary of a Frisbee And a Dog who must Outrace a Lumberjack in Nigeria,Games,4.99,173,R,"JOHNNY LOLLOBRIGIDA, RIVER DEAN, RENEE TRACY, WOODY JOLIE, CHRISTIAN AKROYD"
317,FIREBALL PHILADELPHIA,A Amazing Yarn of a Dentist And a A Shark who must Vanquish a Madman in An Abandoned Mine Shaft,Comedy,0.99,148,PG,"JAMES PITT, ADAM GRANT, FRANCES TOMEI, VAL BOLGER, JUDE CRUISE"
318,FIREHOUSE VIETNAM,A Awe-Inspiring Character Study of a Boat And a Boy who must Kill a Pastry Chef in The Sahara Desert,Action,0.99,103,G,"MATTHEW LEIGH, SANDRA PECK, OLYMPIA PFEIFFER, BEN HARRIS, FAY WINSLET"
319,FISH OPUS,A Touching Display of a Feminist And a Girl who must Confront a Astronaut in Australia,Sci-Fi,2.99,125,R,"LAURENCE BULLOCK, PARKER GOLDBERG"
320,FLAMINGOS CONNECTICUT,A Fast-Paced Reflection of a Composer And a Composer who must Meet a Cat in The Sahara Desert,New,4.99,80,PG-13,"TOM MIRANDA, GOLDIE BRODY, GENE WILLIS, JANE JACKMAN, RITA REYNOLDS, ALBERT JOHANSSON, JON CHASE, KENNETH TORN, FAY KILMER"
321,FLASH WARS,A Astounding Saga of a Moose And a Pastry Chef who must Chase a Student in The Gulf of Mexico,New,4.99,123,NC-17,"NICK WAHLBERG, MATTHEW JOHANSSON, GRETA MALDEN, MILLA KEITEL, SANDRA PECK, KIRSTEN PALTROW, DAN TORN"
322,FLATLINERS KILLER,A Taut Display of a Secret Agent And a Waitress who must Sink a Robot in An Abandoned Mine Shaft,Sports,2.99,100,G,"JIM MOSTEL, RUSSELL BACALL, MORGAN HOPKINS, SCARLETT BENING, GARY PENN, NICK STALLONE, MENA HOPPER, ROCK DUKAKIS, KENNETH TORN"
324,FLINTSTONES HAPPINESS,A Fateful Story of a Husband And a Moose who must Vanquish a Boy in California,Comedy,4.99,148,PG-13,"DEBBIE AKROYD, BELA WALKEN, HUMPHREY WILLIS, ALBERT NOLTE"
325,FLOATS GARDEN,A Action-Packed Epistle of a Robot And a Car who must Chase a Boat in Ancient Japan,Animation,2.99,145,PG-13,"SEAN WILLIAMS, ELLEN PRESLEY, RIP WINSLET, JIM MOSTEL, CAMERON ZELLWEGER"
326,FLYING HOOK,A Thrilling Display of a Mad Cow And a Dog who must Challenge a Frisbee in Nigeria,Animation,2.99,69,NC-17,"GRETA MALDEN, GRETA KEITEL, KENNETH HOFFMAN, NICK DEGENERES, CUBA OLIVIER, CATE MCQUEEN, WALTER TORN, JOHNNY CAGE"
327,FOOL MOCKINGBIRD,A Lacklusture Tale of a Crocodile And a Composer who must Defeat a Madman in A U-Boat,Action,4.99,158,PG,"NATALIE HOPKINS, RIP CRAWFORD"
328,FOREVER CANDIDATE,A Unbelieveable Panorama of a Technical Writer And a Man who must Pursue a Frisbee in A U-Boat,Children,2.99,131,NC-17,JADA RYDER
329,FORREST SONS,A Thrilling Documentary of a Forensic Psychologist And a Butler who must Defeat a Explorer in A Jet Boat,Action,2.99,63,R,"MARY KEITEL, WALTER TORN, DARYL WAHLBERG, RIP CRAWFORD, ED CHASE"
330,FORRESTER COMANCHEROS,A Fateful Tale of a Squirrel And a Forensic Psychologist who must Redeem a Man in Nigeria,Animation,4.99,112,NC-17,"KIRK JOVOVICH, REESE KILMER, SEAN GUINESS"
331,FORWARD TEMPLE,A Astounding Display of a Forensic Psychologist And a Mad Scientist who must Challenge a Girl in New Orleans,Games,2.99,90,NC-17,"GREG CHAPLIN, SEAN WILLIAMS, RIP WINSLET"
332,FRANKENSTEIN STRANGER,A Insightful Character Study of a Feminist And a Pioneer who must Pursue a Pastry Chef in Nigeria,Comedy,0.99,159,NC-17,"BEN HARRIS, SCARLETT DAMON"
333,FREAKY POCUS,A Fast-Paced Documentary of a Pastry Chef And a Crocodile who must Chase a Squirrel in The Gulf of Mexico,Music,2.99,126,R,"TOM MIRANDA, SIDNEY CROWE, KEVIN GARLAND, FAY WINSLET, MATTHEW LEIGH"
334,FREDDY STORM,A Intrepid Saga of a Man And a Lumberjack who must Vanquish a Husband in The Outback,Horror,4.99,65,NC-17,"JULIA MCQUEEN, HENRY BERRY, WALTER TORN"
335,FREEDOM CLEOPATRA,A Emotional Reflection of a Dentist And a Mad Cow who must Face a Squirrel in A Baloon,Comedy,0.99,133,PG-13,"CHRISTOPHER BERRY, RAY JOHANSSON, TOM MCKELLEN, CAMERON STREEP, ALEC WAYNE"
336,FRENCH HOLIDAY,A Thrilling Epistle of a Dog And a Feminist who must Kill a Madman in Berlin,Documentary,4.99,99,PG,"CATE MCQUEEN, AUDREY OLIVIER, JODIE DEGENERES, DAN STREEP, WILL WILSON, HUMPHREY GARLAND, ED CHASE"
337,FRIDA SLIPPER,A Fateful Story of a Lumberjack And a Car who must Escape a Boat in An Abandoned Mine Shaft,Foreign,2.99,73,R,"JAYNE NEESON, UMA WOOD, RENEE TRACY, KENNETH TORN, MINNIE ZELLWEGER"
338,FRISCO FORREST,A Beautiful Documentary of a Woman And a Pioneer who must Pursue a Mad Scientist in A Shark Tank,Sci-Fi,4.99,51,PG,"KIRSTEN AKROYD, GINA DEGENERES, TOM MCKELLEN, RICHARD PENN, DAN STREEP, LIZA BERGMAN, ALBERT NOLTE, ROCK DUKAKIS, ANGELA HUDSON"
339,FROGMEN BREAKING,A Unbelieveable Yarn of a Mad Scientist And a Cat who must Chase a Lumberjack in Australia,Travel,0.99,111,R,"LAURENCE BULLOCK, BEN WILLIS, ELLEN PRESLEY, MORGAN MCDORMAND, RIVER DEAN, RUSSELL TEMPLE"
340,FRONTIER CABIN,A Emotional Story of a Madman And a Waitress who must Battle a Teacher in An Abandoned Fun House,New,4.99,183,PG-13,"BEN WILLIS, JUDE CRUISE, FAY KILMER, RIP CRAWFORD, JOHNNY LOLLOBRIGIDA, HARVEY HOPE"
341,FROST HEAD,A Amazing Reflection of a Lumberjack And a Cat who must Discover a Husband in A MySQL Convention,Classics,0.99,82,PG,"ED CHASE, LAURENCE BULLOCK, CARMEN HUNT, RALPH CRUZ, GENE HOPKINS, CATE HARRIS, FAY WINSLET"
342,FUGITIVE MAGUIRE,A Taut Epistle of a Feminist And a Sumo Wrestler who must Battle a Crocodile in Australia,Travel,4.99,83,R,"MEG HAWKE, RICHARD PENN, EMILY DEE, LAURA BRODY, OLYMPIA PFEIFFER, GEOFFREY HESTON, CUBA OLIVIER, ALEC WAYNE, MARY TANDY, RALPH CRUZ, CHARLIZE DENCH"
343,FULL FLATLINERS,A Beautiful Documentary of a Astronaut And a Moose who must Pursue a Monkey in A Shark Tank,Children,2.99,94,PG,"SCARLETT BENING, RALPH CRUZ, CARY MCCONAUGHEY, MICHELLE MCCONAUGHEY, SUSAN DAVIS, LAURA BRODY"
344,FURY MURDER,A Lacklusture Reflection of a Boat And a Forensic Psychologist who must Fight a Waitress in A Monastery,Children,0.99,178,PG-13,"LAURA BRODY, WOODY JOLIE, KIRK JOVOVICH, KARL BERRY"
345,GABLES METROPOLIS,A Fateful Display of a Cat And a Pioneer who must Challenge a Pastry Chef in A Baloon Factory,Family,0.99,161,PG,"FRANCES DAY-LEWIS, RIP CRAWFORD, FRED COSTNER, GROUCHO DUNST, RAY JOHANSSON, CATE MCQUEEN, ADAM HOPPER, GROUCHO WILLIAMS"
346,GALAXY SWEETHEARTS,A Emotional Reflection of a Womanizer And a Pioneer who must Face a Squirrel in Berlin,Classics,4.99,128,R,"THORA TEMPLE, UMA WOOD, DEBBIE AKROYD"
347,GAMES BOWFINGER,A Astounding Documentary of a Butler And a Explorer who must Challenge a Butler in A Monastery,Travel,4.99,119,PG-13,"FRANCES TOMEI, HUMPHREY WILLIS, MARY KEITEL, JULIA MCQUEEN, ANGELA HUDSON, RIP WINSLET, BURT POSEY, MATTHEW LEIGH"
348,GANDHI KWAI,A Thoughtful Display of a Mad Scientist And a Secret Agent who must Chase a Boat in Berlin,Family,0.99,86,PG-13,"LUCILLE TRACY, MEG HAWKE, ANNE CRONYN, PENELOPE PINKETT, GINA DEGENERES, ANGELINA ASTAIRE, DARYL CRAWFORD, ZERO CAGE"
349,GANGS PRIDE,A Taut Character Study of a Woman And a A Shark who must Confront a Frisbee in Berlin,Animation,2.99,185,PG-13,"FAY WOOD, ELVIS MARX, KENNETH HOFFMAN, FRANCES DAY-LEWIS"
350,GARDEN ISLAND,A Unbelieveable Character Study of a Womanizer And a Madman who must Reach a Man in The Outback,Sci-Fi,4.99,80,G,"MARY TANDY, WARREN NOLTE, JADA RYDER"
351,GASLIGHT CRUSADE,A Amazing Epistle of a Boy And a Astronaut who must Redeem a Man in The Gulf of Mexico,Horror,2.99,106,PG,"FAY WINSLET, RICHARD PENN, WALTER TORN, GRACE MOSTEL, JULIA BARRYMORE"
352,GATHERING CALENDAR,A Intrepid Tale of a Pioneer And a Moose who must Conquer a Frisbee in A MySQL Convention,Games,0.99,176,PG-13,"MICHAEL BENING, MERYL ALLEN, BURT TEMPLE"
353,GENTLEMEN STAGE,A Awe-Inspiring Reflection of a Monkey And a Student who must Overcome a Dentist in The First Manned Space Station,Foreign,2.99,125,NC-17,"GRETA MALDEN, TOM MCKELLEN, DARYL WAHLBERG, MORGAN HOPKINS, LIZA BERGMAN, RITA REYNOLDS, HARVEY HOPE, ED GUINESS"
354,GHOST GROUNDHOG,A Brilliant Panorama of a Madman And a Composer who must Succumb a Car in Ancient India,Children,4.99,85,G,"RENEE BALL, KENNETH TORN, DAN HARRIS, RUSSELL TEMPLE, KEVIN GARLAND"
355,GHOSTBUSTERS ELF,A Thoughtful Epistle of a Dog And a Feminist who must Chase a Composer in Berlin,Animation,0.99,101,R,JENNIFER DAVIS
356,GIANT TROOPERS,A Fateful Display of a Feminist And a Monkey who must Vanquish a Monkey in The Canadian Rockies,Children,2.99,102,R,MATTHEW LEIGH
357,GILBERT PELICAN,A Fateful Tale of a Man And a Feminist who must Conquer a Crocodile in A Manhattan Penthouse,Classics,0.99,114,G,"NICK WAHLBERG, SANDRA PECK, RIP WINSLET, RITA REYNOLDS"
358,GILMORE BOILED,A Unbelieveable Documentary of a Boat And a Husband who must Succumb a Student in A U-Boat,Classics,0.99,163,R,"WOODY HOFFMAN, BURT TEMPLE, MENA HOPPER, CATE HARRIS, MEG HAWKE, MENA TEMPLE"
359,GLADIATOR WESTWARD,A Astounding Reflection of a Squirrel And a Sumo Wrestler who must Sink a Dentist in Ancient Japan,Family,4.99,173,PG,"JAYNE SILVERSTONE, IAN TANDY, CAMERON ZELLWEGER, ADAM GRANT, JULIA MCQUEEN, KIRK JOVOVICH"
360,GLASS DYING,A Astounding Drama of a Frisbee And a Astronaut who must Fight a Dog in Ancient Japan,Action,0.99,103,G,"MICHAEL BOLGER, AL GARLAND, SUSAN DAVIS, MATTHEW LEIGH"
361,GLEAMING JAWBREAKER,A Amazing Display of a Composer And a Forensic Psychologist who must Discover a Car in The Canadian Rockies,Sports,2.99,89,NC-17,"IAN TANDY, MARY TANDY, PENELOPE GUINESS, JAYNE SILVERSTONE, JOHN SUVARI, NICK DEGENERES, ALBERT NOLTE, RIVER DEAN"
362,GLORY TRACY,A Amazing Saga of a Woman And a Womanizer who must Discover a Cat in The First Manned Space Station,Games,2.99,115,PG-13,"RUSSELL TEMPLE, ADAM GRANT, CHRISTIAN NEESON, RALPH CRUZ, WILLIAM HACKMAN, DEBBIE AKROYD"
363,GO PURPLE,A Fast-Paced Display of a Car And a Database Administrator who must Battle a Woman in A Baloon,Music,0.99,54,R,"GENE MCKELLEN, SALMA NOLTE, SEAN GUINESS"
364,GODFATHER DIARY,A Stunning Saga of a Lumberjack And a Squirrel who must Chase a Car in The Outback,New,2.99,73,NC-17,"ZERO CAGE, RITA REYNOLDS, ED MANSFIELD, LAURA BRODY, GREG CHAPLIN, REESE WEST"
365,GOLD RIVER,A Taut Documentary of a Database Administrator And a Waitress who must Reach a Mad Scientist in A Baloon Factory,Comedy,4.99,154,R,"GROUCHO DUNST, RUSSELL TEMPLE"
